,Year,Term,Subject,Number,Name,Description,Credit Hours,Degree Attributes,Type,Start Time,End Time,Days of Week,Instructors,Class,ProfRating,GPA,Reddit_Links
103,2024,Spring,CPSC,241,Intro to Applied Statistics,"Introduces fundamental statistical procedures used to analyze and interpret data. General principles of descriptive and inferential statistics, measures of central tendency and dispersion, probability, correlation and regression, and tests of hypotheses are covered. An emphasis is placed on biological, environmental, and agricultural sciences, but numerous examples from other areas are discussed. Course content enhances students' ability to critically assess statistical information encountered in professional and every day activities. Credit is not given for both CPSC 241 and STAT 100, ACE 261 or ACE 262.",3 hours.,Quantitative Reasoning I course.,Lecture,11:00 AM,11:50 AM,MW,"Martin, N",CPSC 241,4.8,3.3072,https://www.reddit.com/r/UIUC/search/?q=CPSC241&type=link&cId=b32ceb77-1b8c-40e5-8b34-d2b4fec8c4b6&iId=bfd40497-f1e5-4941-9509-aa6fccd80b9e
104,2024,Spring,CPSC,261,Biotechnology in Agriculture,"Basic introduction to the techniques and application of biotechnology to a wide range of agricultural areas, and specific examples are given. May serve as either a terminal course explaining the techniques or as an introductory base for future studies. Prerequisite: Any 100-level course in a biosciences discipline.",3 hours.,Nat Sci & Tech - Life Sciences course.,Lecture-Discussion,09:30 AM,10:50 AM,TR,"Moose, S",CPSC 261,3.0,,https://www.reddit.com/r/UIUC/search/?q=CPSC261&type=link&cId=b32ceb77-1b8c-40e5-8b34-d2b4fec8c4b6&iId=bfd40497-f1e5-4941-9509-aa6fccd80b9e
105,2024,Spring,CS,101,Intro Computing: Engrg &amp; Sci,"Fundamental principles, concepts, and methods of computing, with emphasis on applications in the physical sciences and engineering. Basic problem solving and programming techniques; fundamental algorithms and data structures; use of computers in solving engineering and scientific problems. Intended for engineering and science majors. Prerequisite: One of MATH 220 or MATH 221 or MATH 231 or MATH 241.",3 hours.,Quantitative Reasoning II course.,Lecture,11:00 AM,11:50 AM,MW,"Beckman, M",CS 101,-1.0,3.5520385395537524,https://www.reddit.com/r/UIUC/search/?q=CS101&type=link&cId=b32ceb77-1b8c-40e5-8b34-d2b4fec8c4b6&iId=bfd40497-f1e5-4941-9509-aa6fccd80b9e
106,2024,Spring,CS,105,Intro Computing: Non-Tech,"Computing as an essential tool of academic and professional activities. Functions and interrelationships of computer system components: hardware, systems and applications software, and networks. Widely used application packages such as spreadsheets and databases. Concepts and practice of programming for the solution of simple problems in different application areas. Intended for non-science and non-engineering majors. Prerequisite: MATH 112.",3 hours.,Quantitative Reasoning I course.,Lecture,01:00 PM,02:45 PM,F,"Cunningham, K;Lewis, C",CS 105,-1.0,3.057390862944162,https://www.reddit.com/r/UIUC/search/?q=CS105&type=link&cId=b32ceb77-1b8c-40e5-8b34-d2b4fec8c4b6&iId=bfd40497-f1e5-4941-9509-aa6fccd80b9e
107,2024,Spring,CS,124,Introduction to Computer Science I,Basic concepts in computing and fundamental techniques for solving computational problems. Intended as a first course for computer science majors and others with a deep interest in computing. Credit is not given for both CS 124 and CS 125. Prerequisite: Three years of high school mathematics or MATH 112.,3 hours.,Quantitative Reasoning I course.,Online Lecture,ARRANGED,,,"Challen, G",CS 124,3.4,3.6407465825446894,https://www.reddit.com/r/UIUC/search/?q=CS124&type=link&cId=b32ceb77-1b8c-40e5-8b34-d2b4fec8c4b6&iId=bfd40497-f1e5-4941-9509-aa6fccd80b9e
108,2024,Spring,CS,128,Introduction to Computer Science II,Continuation of CS 124. More advanced concepts in computing and techniques and approaches for solving computational problems. Prerequisite: CS 124 or CS 125.,3 hours.,Quantitative Reasoning II course.,Online Lecture,ARRANGED,,,"Nowak, M;Schatz, J",CS 128,2.8,3.4416622691292886,https://www.reddit.com/r/UIUC/search/?q=CS128&type=link&cId=b32ceb77-1b8c-40e5-8b34-d2b4fec8c4b6&iId=bfd40497-f1e5-4941-9509-aa6fccd80b9e
109,2024,Spring,CS,211,Ethical and Professional Conduct,"Navigating the complex ethical and professional landscape of the computing professional: privacy, intellectual property, cybersecurity, and freedom of speech. Hands-on exercises, assignments, and discussions in which students analyze current events from perspectives in both philosophical and professional ethics. Writing professionally and technically in several writing assignments requiring peer review, workshops, and multiple rounds of editing and revising. Credit is not given for both CS 211 and CS 210 or ECE 316. Prerequisite: CS 225.",3 hours.,Advanced Composition course.,Online,10:00 AM,12:50 PM,F,"Winter, G",CS 211,2.1,3.700878048780488,https://www.reddit.com/r/UIUC/search/?q=CS211&type=link&cId=b32ceb77-1b8c-40e5-8b34-d2b4fec8c4b6&iId=bfd40497-f1e5-4941-9509-aa6fccd80b9e
110,2024,Spring,CS,225,Data Structures,"Data abstractions: elementary data structures (lists, stacks, queues, and trees) and their implementation using an object-oriented programming language. Solutions to a variety of computational problems such as search on graphs and trees. Elementary analysis of algorithms. Credit is not given for CS 277 if credit for CS 225 has been earned. Prerequisite: CS 126 or CS 128 or ECE 220; One of CS 173, CS 413, MATH 213, MATH 347, MATH 412, or MATH 413.",4 hours.,Quantitative Reasoning II course.,Lecture,11:00 AM,11:50 AM,MWF,"Erickson, J;Evans, C;Solomon, B",CS 225,4.4,3.542676797194623,https://www.reddit.com/r/UIUC/search/?q=CS225&type=link&cId=b32ceb77-1b8c-40e5-8b34-d2b4fec8c4b6&iId=bfd40497-f1e5-4941-9509-aa6fccd80b9e
111,2024,Spring,CS,493,"Senior Project II, ACP",Continuation of CS 492. Identical to CS 494 except for an additional writing component. See CS 494. 3 undergraduate hours. No graduate credit. Credit is not given for both CS 493 and a project course in another engineering department for the same project. Prerequisite: CS 492.,3 hours.,Advanced Composition course.,Lecture-Discussion,09:30 AM,10:20 AM,R,"Woodley, M",CS 493,2.6,,https://www.reddit.com/r/UIUC/search/?q=CS493&type=link&cId=b32ceb77-1b8c-40e5-8b34-d2b4fec8c4b6&iId=bfd40497-f1e5-4941-9509-aa6fccd80b9e
112,2024,Spring,CW,100,Intro to Creative Writing,"Acquaints students with the technical choices a writer makes in creating a story or a poem. Classes will consist of lectures on specific elements of poetry, fiction, and creative nonfiction. Students will also have the opportunity to talk with visiting writers and work in small groups to apply the course techniques and skills to a close reading of stories and poems.",3 hours.,Humanities - Lit & Arts course.,Lecture-Discussion,02:00 PM,03:15 PM,MW,"Bales, A",CW 100,5.0,3.5570807453416147,https://www.reddit.com/r/UIUC/search/?q=CW100&type=link&cId=b32ceb77-1b8c-40e5-8b34-d2b4fec8c4b6&iId=bfd40497-f1e5-4941-9509-aa6fccd80b9e
113,2024,Spring,CW,243,"The Craft Essay: Creative Reading, Reflection, and Revision","In this writing- and reading-intensive composition class, students will look at how creative writers—fiction writers, poets, and essayists—write about creative writing outside of the standard literary analysis model. Realizing that there are other methods of discussing, analyzing, and considering literature is a major goal of this class. As a complement to the production of creative work, students will focus on how we analyze, consider, and place that work within the greater context of creative writing. Prerequisite: Completion of campus Composition I general education requirement.",3 hours.,Advanced Composition course.,Lecture-Discussion,09:30 AM,10:45 AM,TR,"Dudek, J",CW 243,4.8,3.349047619047619,https://www.reddit.com/r/UIUC/search/?q=CW243&type=link&cId=b32ceb77-1b8c-40e5-8b34-d2b4fec8c4b6&iId=bfd40497-f1e5-4941-9509-aa6fccd80b9e
114,2024,Spring,CWL,207,Indian Cinema in Context,"Introduction to Indian mainstream (mainly Bollywood) cinema and its evolution through the last seven decades. Topics to be explored include, but not limited to, the relation between Indian society/culture and its cinematic representations, cinema's resistance to dominant nationalist and patriarchal ideologies, its interactions with the postcolonial nation-state of India, how globalization has changed the industry. All films will be screened with subtitles. No knowledge of Hindi or any other Indian language is required. Same as MACS 207.",3 hours.,"Humanities - Lit & Arts, and Cultural Studies - Non-West course.",Lecture-Discussion,02:00 PM,03:20 PM,MW,"Mehta, R",CWL 207,2.8,3.956883561643835,https://www.reddit.com/r/UIUC/search/?q=CWL207&type=link&cId=b32ceb77-1b8c-40e5-8b34-d2b4fec8c4b6&iId=bfd40497-f1e5-4941-9509-aa6fccd80b9e
115,2024,Spring,CWL,242,Modern Masterpieces of Western Culture,"Comparative study of major works of literature, philosophy and culture in the Western tradition from the Enlightenment to today, from Descartes and Voltaire to Dickinson and Calvino. Emphasis on the works as representative of their historical and cultural period, as well as how these works create the cultural world we live in today.",3 hours.,"Advanced Composition, Humanities - Lit & Arts, and Cultural Studies - Western course.",Lecture,11:00 AM,11:50 AM,MW,"Gasyna, G",CWL 242,5.0,3.3458536585365857,https://www.reddit.com/r/UIUC/search/?q=CWL242&type=link&cId=b32ceb77-1b8c-40e5-8b34-d2b4fec8c4b6&iId=bfd40497-f1e5-4941-9509-aa6fccd80b9e
116,2024,Spring,DANC,100,Intro to Contemporary Dance,"Overview of major works, figures, and trends responsible for shaping dance as an evolving contemporary art form. The course will have lecture, viewing, discussion and experiential (studio participation) components. For non-dance majors.",3 hours.,"Humanities - Lit & Arts, and Cultural Studies - Western course.",Lecture,09:00 AM,10:20 AM,T,"Chiaramonte, L",DANC 100,-1.0,3.780811965811965,https://www.reddit.com/r/UIUC/search/?q=DANC100&type=link&cId=b32ceb77-1b8c-40e5-8b34-d2b4fec8c4b6&iId=bfd40497-f1e5-4941-9509-aa6fccd80b9e
117,2024,Spring,DANC,200,Explore Music through Dance,"In-depth study of musical form, history, culture, and styles, taught from a physical learning, i.e., dance, perspective. Musical and dance forms will be studied across cultures and time periods, from both a technical and a cross-cultural perspective. Content will be delivered as a series of video lectures and performances, and online readings. Students will create movement studies that mirror the musical forms being analyzed, produce video documentation of these works, engage in peer review of other students' performance work, and complete exams that cover the cultural and historical aspects of the examples studied.",3 hours.,Humanities - Lit & Arts course.,Online,ARRANGED,,,"Jensen, C",DANC 200,-1.0,3.750970873786408,https://www.reddit.com/r/UIUC/search/?q=DANC200&type=link&cId=b32ceb77-1b8c-40e5-8b34-d2b4fec8c4b6&iId=bfd40497-f1e5-4941-9509-aa6fccd80b9e
118,2024,Spring,DANC,340,Dancing Black Popular Culture,"Introduction to black dance aesthetics and its interconnectedness with American popular culture. By exploring its cultural, political and historical roots, coupled with theoretical concepts of ""the popular"" and ties to the vernacular, the course will be organized around significant markers that have shaped black dance's development. Same as AFRO 340.",3 hours.,"Advanced Composition, Humanities - Hist & Phil, and Cultural Studies - US Minority course.",Online,ARRANGED,,,"Bowie, J;Segale, M",DANC 340,-1.0,3.238571428571428,https://www.reddit.com/r/UIUC/search/?q=DANC340&type=link&cId=b32ceb77-1b8c-40e5-8b34-d2b4fec8c4b6&iId=bfd40497-f1e5-4941-9509-aa6fccd80b9e
119,2024,Spring,EALC,207,Classical Chinese Lit,"Surveys Chinese literary works from the classical tradition (history, philosophy, poetry, literary criticism) with attention to intellectual and artistic values. Same as CWL 217. No knowledge of Chinese is required.",3 hours.,"Humanities - Lit & Arts, and Cultural Studies - Non-West course.",Lecture-Discussion,02:00 PM,03:20 PM,TR,"Wang, Y",EALC 207,2.4,,https://www.reddit.com/r/UIUC/search/?q=EALC207&type=link&cId=b32ceb77-1b8c-40e5-8b34-d2b4fec8c4b6&iId=bfd40497-f1e5-4941-9509-aa6fccd80b9e
120,2024,Spring,EALC,230,Popular Cultures of Contemporary East Asia,"An introduction to the popular cultures and subcultures of China, Korea, and Japan through exposure to popular films, music, anime, games, and everyday practices. Already hugely popular in its home countries, East Asian popular culture has become familiar to American audiences through films, video games, food, toys, and comic books. The course explores the historical, social, cultural, and economic roots of this global appeal, while gauging popular culture's impact on national identity, gender, and lifestyle. No knowledge of East Asian languages is required. Same as CWL 230.",3 hours.,"Humanities - Lit & Arts, and Cultural Studies - Non-West course.",Lecture,02:00 PM,02:50 PM,MW,"Chen, J",EALC 230,3.0,3.807179487179487,https://www.reddit.com/r/UIUC/search/?q=EALC230&type=link&cId=b32ceb77-1b8c-40e5-8b34-d2b4fec8c4b6&iId=bfd40497-f1e5-4941-9509-aa6fccd80b9e
121,2024,Spring,EALC,250,Intro to Japanese Culture,"Topical introduction to Japanese cultural and aesthetic life with attention to cultural and aesthetic patterns as they are reflected in literature, language, and the arts.",3 hours.,"Cultural Studies - Non-West, and Social & Beh Sci - Soc Sci course.",Lecture,11:00 AM,11:50 AM,MW,"Gunji, N",EALC 250,1.5,2.992142857142857,https://www.reddit.com/r/UIUC/search/?q=EALC250&type=link&cId=b32ceb77-1b8c-40e5-8b34-d2b4fec8c4b6&iId=bfd40497-f1e5-4941-9509-aa6fccd80b9e
122,2024,Spring,EALC,275,Masterpieces of East Asian Lit,"A wide-ranging introduction to the literatures of traditional China, Korea, and Japan. Selections from novels, plays, and poems are studied to gain insight into the cultures that produced them and to hone skills in textual analyses. Explores how influential texts have been repackaged and reinterpreted for modern audiences in media such as film and manga. Same as CWL 275. No knowledge of Chinese or Japanese language required.",3 hours.,"Humanities - Lit & Arts, and Cultural Studies - Non-West course.",Lecture,04:00 PM,04:50 PM,MW,"Chen, J",EALC 275,3.0,,https://www.reddit.com/r/UIUC/search/?q=EALC275&type=link&cId=b32ceb77-1b8c-40e5-8b34-d2b4fec8c4b6&iId=bfd40497-f1e5-4941-9509-aa6fccd80b9e
123,2024,Spring,EALC,285,Intro to Korea Through Film,"Course uses film, literary, and ethnographic works to explore the impact of Post-Colonial (1945-present) socioeconomic and cultural transformation on the personal and collective South Korean experience. Same as ANTH 285.",3 hours.,Cultural Studies - Non-West course.,Lecture-Discussion,12:30 PM,01:50 PM,TR,"Song, M",EALC 285,-1.0,3.8116666666666665,https://www.reddit.com/r/UIUC/search/?q=EALC285&type=link&cId=b32ceb77-1b8c-40e5-8b34-d2b4fec8c4b6&iId=bfd40497-f1e5-4941-9509-aa6fccd80b9e
124,2024,Spring,EALC,305,Japan Lit in Translation I,"Survey of Japanese literature from earliest times to 1600; readings in prose, poetry, and drama in English translation. Same as CWL 311.",3 hours.,"Humanities - Lit & Arts, and Cultural Studies - Non-West course.",Lecture-Discussion,01:00 PM,02:20 PM,MW,"Persiani, G",EALC 305,2.9,,https://www.reddit.com/r/UIUC/search/?q=EALC305&type=link&cId=b32ceb77-1b8c-40e5-8b34-d2b4fec8c4b6&iId=bfd40497-f1e5-4941-9509-aa6fccd80b9e
125,2024,Spring,EALC,361,Gender and Women in East Asia,"Interdisciplinary inquiry into the cultural and social patterns that have shaped women's lives in China, Japan, and Korea. Same as GWS 361.",3 hours.,Advanced Composition course.,Lecture-Discussion,11:00 AM,12:20 PM,TR,"Shao, D",EALC 361,1.9,,https://www.reddit.com/r/UIUC/search/?q=EALC361&type=link&cId=b32ceb77-1b8c-40e5-8b34-d2b4fec8c4b6&iId=bfd40497-f1e5-4941-9509-aa6fccd80b9e
126,2024,Spring,ECE,101,Exploring Digital Info Technol,"Principles and processes for the development of information technologies: digital music, digital images, digital logic, data compression, error correction, information security, and communication networks. Laboratory for design of hardware and software, and experiments in audio and image processing. Intended for students outside the College of Engineering. Credit is not given to Computer or Electrical Engineering majors.",3 hours.,"Nat Sci & Tech - Phys Sciences, and Quantitative Reasoning II course.",Lecture,02:00 PM,02:50 PM,MW,"Chakravarty, A",ECE 101,-1.0,,https://www.reddit.com/r/UIUC/search/?q=ECE101&type=link&cId=b32ceb77-1b8c-40e5-8b34-d2b4fec8c4b6&iId=bfd40497-f1e5-4941-9509-aa6fccd80b9e
127,2024,Spring,ECE,316,Ethics and Engineering,"Ethical issues in the practice of engineering: safety and liability, professional responsibility to clients and employers, whistle-blowing, codes of ethics, career choice, and legal obligations. Philosophical analysis of normative ethical theories. Case studies. Same as PHIL 316. Credit is not given for both ECE 316 and either CS 210 or CS 211. Junior standing is required. Prerequisite: RHET 105.",3 hours.,"Advanced Composition, and Humanities - Hist & Phil course.",Lecture,11:00 AM,12:20 PM,TR,"Hillmer, P",ECE 316,4.9,3.281176470588236,https://www.reddit.com/r/UIUC/search/?q=ECE316&type=link&cId=b32ceb77-1b8c-40e5-8b34-d2b4fec8c4b6&iId=bfd40497-f1e5-4941-9509-aa6fccd80b9e
128,2024,Spring,ECON,102,Microeconomic Principles,"Introduction to the functions of individual decision-makers, both consumers and producers, within the larger economic system. Primary emphasis on the nature and functions of product markets, the theory of the firm under varying conditions of competition and monopoly, and the role of government in prompting efficiency in the economy. Credit is not given for ECON 102 and ACE 100.",3 hours.,Social & Beh Sci - Soc Sci course.,Lecture,01:00 PM,01:50 PM,MW,"Buckley, B;Hardiman, A",ECON 102,4.3,3.211482309124768,https://www.reddit.com/r/UIUC/search/?q=ECON102&type=link&cId=b32ceb77-1b8c-40e5-8b34-d2b4fec8c4b6&iId=bfd40497-f1e5-4941-9509-aa6fccd80b9e
129,2024,Spring,ECON,103,Macroeconomic Principles,"Introduction to the theory of determination of total or aggregate income, employment, output, price levels, and the role of money in the economy. Primary emphasis on monetary and fiscal policy, inflation, unemployment, economic growth, and international economics.",3 hours.,Social & Beh Sci - Soc Sci course.,Lecture,09:00 AM,09:50 AM,MW,"Simon, P;Vazquez, J",ECON 103,-1.0,3.5311852231913794,https://www.reddit.com/r/UIUC/search/?q=ECON103&type=link&cId=b32ceb77-1b8c-40e5-8b34-d2b4fec8c4b6&iId=bfd40497-f1e5-4941-9509-aa6fccd80b9e
130,2024,Spring,ECON,202,Economic Statistics I,"Introduction of basic concepts in statistics including the presentation of data, descriptive statistics, probability theory, discrete and continuous distributions, sampling distributions, estimation, and hypothesis testing. The approach of the class includes both learning the concepts behind basic statistics and also how to apply these concepts in ""real-life"" situations. Utilizes a practical project format. To complete the Business Statistics sequence, students must also complete ECON 203. Credit is not given for ECON 202 if credit for a college-level introductory statistics course such as PSYC 235, SOC 280, or STAT 100 has been earned. Prerequisite: Credit or registration in one of MATH 220, MATH 221, MATH 234.",3 hours.,Quantitative Reasoning I course.,Lecture,11:00 AM,12:20 PM,TR,"Hendershott, C;Schultz, C",ECON 202,-1.0,3.010449101796407,https://www.reddit.com/r/UIUC/search/?q=ECON202&type=link&cId=b32ceb77-1b8c-40e5-8b34-d2b4fec8c4b6&iId=bfd40497-f1e5-4941-9509-aa6fccd80b9e
131,2024,Spring,EDUC,201,Identity and Difference in Education,"Focuses on the role of identity in schooling and the way in which identity is socially constructed. Examine how power and privilege impact equity and opportunities based on socially constructed identities such as race, social class, gender, sexual identity, language, (dis)ability, and nationalism. Explore asset-based frameworks that are identity affirming and counter deficit-based perspectives. This course is designed for students interested in reflecting on their own experiences as learners by critically examining their socially constructed identities and ""ways of knowing"" and the societal implications of these experiences. It is also for those considering careers in teaching, and anyone interested in reflecting on how issues of inclusion, exclusion, power, and privilege play out in education.",3 hours.,Cultural Studies - US Minority course.,Lecture,09:00 AM,09:50 AM,W,"Mason, C",EDUC 201,3.9,3.622622377622378,https://www.reddit.com/r/UIUC/search/?q=EDUC201&type=link&cId=b32ceb77-1b8c-40e5-8b34-d2b4fec8c4b6&iId=bfd40497-f1e5-4941-9509-aa6fccd80b9e
132,2024,Spring,EDUC,202,"Social Justice, School and Society","Examines the nature of justice and the dynamics of a pluralistic society to derive a conception of social justice. Working with this conception, it asks how schools function to perpetuate and/or remediate social injustice. The course will consider the history and nature of schooling, issues of access and tracking, and notions of the public and the common. The course is designed for students interested in reflecting on their own educational histories, for those considering careers in teaching, and for all future parents and citizens needing to be able to reflect critically on justice, school, and society.",3 hours.,"Advanced Composition, and Humanities - Hist & Phil course.",Online Lecture,11:00 AM,11:50 AM,T,"Wilson, A",EDUC 202,-1.0,3.704208333333333,https://www.reddit.com/r/UIUC/search/?q=EDUC202&type=link&cId=b32ceb77-1b8c-40e5-8b34-d2b4fec8c4b6&iId=bfd40497-f1e5-4941-9509-aa6fccd80b9e
133,2024,Spring,ENGL,104,Introduction to Film,"Thoughtful viewing of diverse films (in required weekly screenings), along with ample discussion and critical reading and writing, to gain understanding of cinematic expression and of film's capacity to entertain and to exert artistic and social influence. Same as MACS 104.",3 hours.,Humanities - Lit & Arts course.,Lecture-Discussion,11:00 AM,11:50 AM,MWF,"Slobodnik, S",ENGL 104,2.5,3.634705882352941,https://www.reddit.com/r/UIUC/search/?q=ENGL104&type=link&cId=b32ceb77-1b8c-40e5-8b34-d2b4fec8c4b6&iId=bfd40497-f1e5-4941-9509-aa6fccd80b9e
134,2024,Spring,ENGL,109,Intro to Fiction-ACP,"Introduction to critical analysis of prose fiction. Explores a wide range of short and long fiction across historical periods; examines narrative strategies such as plot, character, and point of view. Special emphasis placed on good literary critical writing. Course is similar to ENGL 103 except for the additional writing component. Credit is not given for both ENGL 109 and ENGL 103. Prerequisite: Completion of campus Composition I general education requirement.",3 hours.,"Advanced Composition, and Humanities - Lit & Arts course.",Lecture-Discussion,11:00 AM,11:50 AM,MWF,"Rivera Lopez, M",ENGL 109,-1.0,3.568461538461538,https://www.reddit.com/r/UIUC/search/?q=ENGL109&type=link&cId=b32ceb77-1b8c-40e5-8b34-d2b4fec8c4b6&iId=bfd40497-f1e5-4941-9509-aa6fccd80b9e
135,2024,Spring,ENGL,115,Intro to British Literature,"Acquaints students with the rich diversity of British prose, poetry, and drama. As a basic introduction to English literature, the course explores a series of literary texts, often thematically related, which appeal to modern readers and at the same time provide interesting insights into the cultural attitudes and values of the periods which produced them.",3 hours.,"Humanities - Lit & Arts, and Cultural Studies - Western course.",Lecture-Discussion,12:00 PM,12:50 PM,MWF,"Travis, T",ENGL 115,3.0,3.745818181818181,https://www.reddit.com/r/UIUC/search/?q=ENGL115&type=link&cId=b32ceb77-1b8c-40e5-8b34-d2b4fec8c4b6&iId=bfd40497-f1e5-4941-9509-aa6fccd80b9e
136,2024,Spring,ENGL,116,Introduction to American Literature,"American literature speaks in distinctive dialects that pre-date the arrival of European explorers in the Renaissance, range across centuries and continents, and intermingle a rich variety of racial, ethnic, and gendered perspectives. Genres examined in this course might include lyric poems, dystopian novels, horror stories, seduction narratives, slave narratives, political speeches, or postmodern plays. Writers studied might include Walt Whitman, Columbus, Jane Johnston Schoolcraft, Herman Melville, Edgar Allan Poe, Junot Díaz, Harriet Beecher Stowe, David Foster Wallace, Martin Luther King, and Lin-Manuel Miranda.",3 hours.,"Humanities - Lit & Arts, and Cultural Studies - Western course.",Lecture-Discussion,10:00 AM,10:50 AM,MWF,"Georgiou, C",ENGL 116,-1.0,3.922333333333333,https://www.reddit.com/r/UIUC/search/?q=ENGL116&type=link&cId=b32ceb77-1b8c-40e5-8b34-d2b4fec8c4b6&iId=bfd40497-f1e5-4941-9509-aa6fccd80b9e
137,2024,Spring,ENGL,120,Science Fiction,"Introduction to the study of science fiction, the genre that has both contributed to scientific knowledge and attempted to make sense of the changes that have taken place in the world since the Enlightenment, the onset of industrialization, and the acceleration of technology. Texts are taken from a variety of literary and pop culture sources: pulps and magazines, novels and films, comics and TV shows.",3 hours.,Humanities - Lit & Arts course.,Lecture-Discussion,09:30 AM,10:45 AM,TR,"Underwood, W",ENGL 120,-1.0,3.4166666666666665,https://www.reddit.com/r/UIUC/search/?q=ENGL120&type=link&cId=b32ceb77-1b8c-40e5-8b34-d2b4fec8c4b6&iId=bfd40497-f1e5-4941-9509-aa6fccd80b9e
