,Year,Term,Subject,Number,Name,Description,Credit Hours,Degree Attributes,Type,Start Time,End Time,Days of Week,Instructors,Class,ProfRating,GPA,Reddit_Links
203,2024,Spring,HIST,143,Modern Europe and the World - ACP,Course is identical to HIST 142 except for the additional writing component. Credit is not given for both HIST 143 and HIST 142. Prerequisite: Completion of campus Composition I General Education requirement.,4 hours.,"Advanced Composition, Humanities - Hist & Phil, and Cultural Studies - Western course.",Lecture,11:00 AM,11:50 AM,MW,"Fritzsche, P",HIST 143,2.3,,https://www.reddit.com/r/UIUC/search/?q=HIST143&type=link&cId=b32ceb77-1b8c-40e5-8b34-d2b4fec8c4b6&iId=bfd40497-f1e5-4941-9509-aa6fccd80b9e
204,2024,Spring,HIST,170,US History to 1877-ACP,Course is identical to HIST 171 except for the additional writing component. Credit is not given for both HIST 170 and HIST 171. Prerequisite: Completion of campus Composition I General Education requirement.,4 hours.,"Advanced Composition, Humanities - Hist & Phil, and Cultural Studies - US Minority course.",Lecture,12:00 PM,12:50 PM,MW,"Hogarth, R",HIST 170,4.5,,https://www.reddit.com/r/UIUC/search/?q=HIST170&type=link&cId=b32ceb77-1b8c-40e5-8b34-d2b4fec8c4b6&iId=bfd40497-f1e5-4941-9509-aa6fccd80b9e
205,2024,Spring,HIST,171,US History to 1877,"U.S. history survey beginning with the diverse peoples who have populated North America since before the age of contact with Europeans and extending forward through the advent of European colonialism, the movement for independence, the foundation of the republic, the Civil War, and Reconstruction, ending in 1877. The course provides an introduction to historical interpretation, with particular attention to racialized and other forms of social, political, and economic inequality and struggles for freedom and democracy. Credit is not given for both HIST 171 and HIST 170.",3 hours.,"Humanities - Hist & Phil, and Cultural Studies - US Minority course.",Lecture,12:00 PM,12:50 PM,MW,"Hogarth, R",HIST 171,4.5,3.043571428571428,https://www.reddit.com/r/UIUC/search/?q=HIST171&type=link&cId=b32ceb77-1b8c-40e5-8b34-d2b4fec8c4b6&iId=bfd40497-f1e5-4941-9509-aa6fccd80b9e
206,2024,Spring,HIST,172,US History Since 1877,"Survey of U.S. history from the end of the Civil War to the present, focusing on struggles to achieve a multiracial democracy, the evolution of an industrial, urbanized, and pluralistic society, the intersections between domestic and global affairs, and the practice of historical interpretation. Epoch-making events and elites are considered in light of their relation to the activities and lives of ordinary people, including people of color, immigrants, women, and the working and middle classes. Credit is not given for both HIST 172 and HIST 173.",3 hours.,"Humanities - Hist & Phil, and Cultural Studies - US Minority course.",Lecture,11:00 AM,11:50 AM,TR,"Barrett, M",HIST 172,5.0,,https://www.reddit.com/r/UIUC/search/?q=HIST172&type=link&cId=b32ceb77-1b8c-40e5-8b34-d2b4fec8c4b6&iId=bfd40497-f1e5-4941-9509-aa6fccd80b9e
207,2024,Spring,HIST,173,US History Since 1877-ACP,Course is identical to HIST 172 except for the additional writing component. Credit is not given for both HIST 173 and HIST 172. Prerequisite: Completion of campus Composition I General Education requirement.,4 hours.,"Advanced Composition, Humanities - Hist & Phil, and Cultural Studies - US Minority course.",Lecture,11:00 AM,11:50 AM,TR,"Barrett, M",HIST 173,5.0,,https://www.reddit.com/r/UIUC/search/?q=HIST173&type=link&cId=b32ceb77-1b8c-40e5-8b34-d2b4fec8c4b6&iId=bfd40497-f1e5-4941-9509-aa6fccd80b9e
208,2024,Spring,HIST,202,American Environmental History,"Introduction to the historical study of Americans' relationship with the natural world. Examination of the ways that ""natural"" forces have helped to shape American history; the ways that human beings have shaped, altered, and interacted with nature over time; and the ways that cultural, philosophical, scientific, and political attitudes toward the environment have changed from pre-history to the present. Same as ESE 202 and NRES 202.",3 hours.,"Humanities - Hist & Phil, and Cultural Studies - Western course.",Lecture-Discussion,11:00 AM,12:20 PM,TR,"Morrissey, R",HIST 202,5.0,2.8783333333333334,https://www.reddit.com/r/UIUC/search/?q=HIST202&type=link&cId=b32ceb77-1b8c-40e5-8b34-d2b4fec8c4b6&iId=bfd40497-f1e5-4941-9509-aa6fccd80b9e
209,2024,Spring,HIST,203,Reacting to the Past,"An introduction to history through participation in role-playing games set in the past. Topics will vary each time the course is taught. Students will take on the roles of historical figures (famous or obscure) engaged in difficult and complicated situations, and will be obliged to adhere to the beliefs and circumstances of those figures while attempting to pursue a course of action that will help them win the game -- and possibly alter the course of history.",3 hours.,Humanities - Hist & Phil course.,Lecture-Discussion,02:00 PM,03:20 PM,MW,"Reagan, L",HIST 203,2.4,3.8058333333333336,https://www.reddit.com/r/UIUC/search/?q=HIST203&type=link&cId=b32ceb77-1b8c-40e5-8b34-d2b4fec8c4b6&iId=bfd40497-f1e5-4941-9509-aa6fccd80b9e
210,2024,Spring,HIST,205,Lived Experience in Latin America,"Examining the history through the primary texts written by Latin Americans, this course introduces students to theories, contents and methods of historical inquiry, as well as the nuances and the complexities of Latin American history. Reading primary texts written by all strata of society, students will look through the eyes of the diverse populations in Latin America. Students will analyze the traditional narrative of Latin America and gain insight into the lived experience of Latin Americans. Together we will advance our individual and collective understanding of Latin America's rich and complex past.",3 hours.,"Humanities - Hist & Phil, and Cultural Studies - Non-West course.",Lecture-Discussion,09:00 AM,10:20 AM,MW,"Brosseder, C",HIST 205,4.0,,https://www.reddit.com/r/UIUC/search/?q=HIST205&type=link&cId=b32ceb77-1b8c-40e5-8b34-d2b4fec8c4b6&iId=bfd40497-f1e5-4941-9509-aa6fccd80b9e
211,2024,Spring,HIST,236,Madness and Modern Society,"This course provides a broad overview of the development of the mind sciences in modern Europe from the beginning of state-regulated asylums to the advent of pharmaceutical treatment and care in the community. Using a combination of primary sources and secondary texts, we will examine how the diagnosis and treatment of ""madness"" in its many forms has been shaped through the interaction of social, political, economic, and cultural factors from roughly 1750 to the 1990s. Same as PSYC 236.",3 hours.,"Humanities - Hist & Phil, and Cultural Studies - Western course.",Lecture,02:00 PM,02:50 PM,MW,"Chettiar, T",HIST 236,5.0,3.651223021582735,https://www.reddit.com/r/UIUC/search/?q=HIST236&type=link&cId=b32ceb77-1b8c-40e5-8b34-d2b4fec8c4b6&iId=bfd40497-f1e5-4941-9509-aa6fccd80b9e
212,2024,Spring,HIST,241,History of Ancient Rome,"Survey of the political, social, economic, military, institutional, religious and cultural development of Rome from 753 BCE until 480 CE.",3 hours.,"Humanities - Hist & Phil, and Cultural Studies - Western course.",Lecture,12:30 PM,01:20 PM,TR,"Mathisen, R",HIST 241,4.9,,https://www.reddit.com/r/UIUC/search/?q=HIST241&type=link&cId=b32ceb77-1b8c-40e5-8b34-d2b4fec8c4b6&iId=bfd40497-f1e5-4941-9509-aa6fccd80b9e
213,2024,Spring,HIST,252,The Holocaust,"Exploration of the Holocaust in historical perspective by examining European anti-Semitism, political developments in Germany, the rise to power of the Nazis, and the origins of the Holocaust with first-hand accounts, films, and historical texts, concluding with the legacy of the Holocaust in the contemporary world. Same as JS 252.",3 hours.,"Humanities - Hist & Phil, and Cultural Studies - Western course.",Lecture-Discussion,01:00 PM,02:20 PM,MW,"Fritzsche, P",HIST 252,2.3,3.244705882352941,https://www.reddit.com/r/UIUC/search/?q=HIST252&type=link&cId=b32ceb77-1b8c-40e5-8b34-d2b4fec8c4b6&iId=bfd40497-f1e5-4941-9509-aa6fccd80b9e
214,2024,Spring,HIST,263,History of Medicine in the United States,"Medicine and public health in the United States from the colonial period through the twentieth century. Topics include medical theories, therapeutic practices, and institutions as determined by science, culture, politics, law, and social structures. Additional attention will be paid to illness and epidemics; health care providers, patients, and public policy. Throughout, the course will highlight race, sex, (dis)ability, and other social categories that have affected medical care and been defined in medical terms. Same as GWS 263.",3 hours.,"Humanities - Hist & Phil, and Cultural Studies - US Minority course.",Lecture,11:00 AM,11:50 AM,MW,"Reagan, L",HIST 263,2.4,3.342093023255814,https://www.reddit.com/r/UIUC/search/?q=HIST263&type=link&cId=b32ceb77-1b8c-40e5-8b34-d2b4fec8c4b6&iId=bfd40497-f1e5-4941-9509-aa6fccd80b9e
215,2024,Spring,HIST,264,Technology in Western Society,"Explores the role of technology as a transforming social force; examines innovations from the stirrup and heavy plow to the airplane and computer, that restructured economic and political life and realigned values; examines cultural representations of technology.",3 hours.,"Humanities - Hist & Phil, and Cultural Studies - Western course.",Lecture-Discussion,12:30 PM,01:50 PM,TR,"Sepkoski, D",HIST 264,4.3,3.500555555555556,https://www.reddit.com/r/UIUC/search/?q=HIST264&type=link&cId=b32ceb77-1b8c-40e5-8b34-d2b4fec8c4b6&iId=bfd40497-f1e5-4941-9509-aa6fccd80b9e
216,2024,Spring,HIST,273,Illinois History,"History of Chicago and Illinois from prehistoric times to the present, illustrating the jarring conflicts and great achievements of peoples from all over the world. Politics, economics, popular and high culture, education, mass media, racial problems, and ethnic diversity are especially featured. There is an emphasis on the relation of city, state, and region to one another.",3 hours.,Humanities - Hist & Phil course.,Online,ARRANGED,,,"Kelley, K",HIST 273,4.3,,https://www.reddit.com/r/UIUC/search/?q=HIST273&type=link&cId=b32ceb77-1b8c-40e5-8b34-d2b4fec8c4b6&iId=bfd40497-f1e5-4941-9509-aa6fccd80b9e
217,2024,Spring,HIST,276,Afro-American Hist Since 1877,History of Afro-Americans in the age of white supremacy; the rise of modern protest organizations; the era of integration; and the black power movement. Same as AFRO 276.,3 hours.,"Humanities - Hist & Phil, and Cultural Studies - US Minority course.",Lecture-Discussion,12:30 PM,01:50 PM,TR,"Cha-Jua, S",HIST 276,2.9,,https://www.reddit.com/r/UIUC/search/?q=HIST276&type=link&cId=b32ceb77-1b8c-40e5-8b34-d2b4fec8c4b6&iId=bfd40497-f1e5-4941-9509-aa6fccd80b9e
218,2024,Spring,HIST,280,Caribbean Latina/o Migration,"Study of the economic, political, and social forces which shaped migration, settlement, and community formation of Puerto Ricans, Cubans, and Dominicans living in the United States. Same as LLS 280.",3 hours.,"Humanities - Hist & Phil, and Cultural Studies - US Minority course.",Lecture-Discussion,01:00 PM,02:20 PM,MW,"Burgos, A",HIST 280,5.0,,https://www.reddit.com/r/UIUC/search/?q=HIST280&type=link&cId=b32ceb77-1b8c-40e5-8b34-d2b4fec8c4b6&iId=bfd40497-f1e5-4941-9509-aa6fccd80b9e
219,2024,Spring,HIST,283,Asian American History,"Exploration of the migrations of peoples from the Asian continent into the United States, their attempts to build family and community, and their subsequent impact on American history. Same as AAS 283.",3 hours.,"Humanities - Hist & Phil, and Cultural Studies - US Minority course.",Lecture-Discussion,10:00 AM,11:20 AM,MW,"Espiritu, A",HIST 283,4.3,2.774090909090909,https://www.reddit.com/r/UIUC/search/?q=HIST283&type=link&cId=b32ceb77-1b8c-40e5-8b34-d2b4fec8c4b6&iId=bfd40497-f1e5-4941-9509-aa6fccd80b9e
220,2024,Spring,HIST,285,US Gender History to 1877,"This course surveys the history of gender formations in the United States to 1877. Although it pays some attention to manhood and masculinity, it focuses on the history of women from a variety of social groups and on gender ideas pertaining to women. Throughout, it considers the ways gender intersected with categories such as race and class as it placed women of different backgrounds in differential positions. Same as GWS 285.",3 hours.,"Humanities - Hist & Phil, and Cultural Studies - US Minority course.",Lecture,11:00 AM,12:20 PM,TR,"Asaka, I",HIST 285,4.4,,https://www.reddit.com/r/UIUC/search/?q=HIST285&type=link&cId=b32ceb77-1b8c-40e5-8b34-d2b4fec8c4b6&iId=bfd40497-f1e5-4941-9509-aa6fccd80b9e
221,2024,Spring,HIST,293,The President and the People,"A chronological survey of the American presidency that examines individual presidents and the times in which they lived. Major themes include: The creation and development of the office of the president; the nature of presidential power; Americans' evolving relationship with presidents; the impact of party politics, campaigning, and the media on the office.",3 hours.,"Camp Honors/Chanc Schol, Humanities - Hist & Phil, and Cultural Studies - Western course.",Lecture,03:30 PM,04:50 PM,TR,"Barrett, M",HIST 293,5.0,,https://www.reddit.com/r/UIUC/search/?q=HIST293&type=link&cId=b32ceb77-1b8c-40e5-8b34-d2b4fec8c4b6&iId=bfd40497-f1e5-4941-9509-aa6fccd80b9e
222,2024,Spring,HORT,223,The Intelligent Behavior of Plants,"This course provides students with an introduction into the study of plant behavior, which focuses on how plants interact with and respond to the world around them. Topics include a basic overview of plant anatomy and physiology, a comparative examination of behavioral and communication mechanisms used by plants and animals, and an analysis of the controversial arguments regarding plant intelligence.",3 hours.,"Advanced Composition, and Nat Sci & Tech - Life Sciences course.",Lecture-Discussion,02:00 PM,03:20 PM,TR,"Hind, S",HORT 223,0.0,,https://www.reddit.com/r/UIUC/search/?q=HORT223&type=link&cId=b32ceb77-1b8c-40e5-8b34-d2b4fec8c4b6&iId=bfd40497-f1e5-4941-9509-aa6fccd80b9e
223,2024,Spring,IB,100,Biology in Today's World,"Introduction to biology for the non-major. In-depth focus on three contemporary problems-maintaining a livable environment, issues of human health, and evolution.",3 hours.,Nat Sci & Tech - Life Sciences course.,Online Lecture,ARRANGED,,,"Yang, W",IB 100,3.0,3.4608426966292134,https://www.reddit.com/r/UIUC/search/?q=IB100&type=link&cId=b32ceb77-1b8c-40e5-8b34-d2b4fec8c4b6&iId=bfd40497-f1e5-4941-9509-aa6fccd80b9e
224,2024,Spring,IB,103,Introduction to Plant Biology,"Basic principles of growth and form, physiology, genetics, evolution, and ecology in plant biology. Lecture and laboratory.",4 hours.,Nat Sci & Tech - Life Sciences course.,Lecture,03:00 PM,03:50 PM,MWF,"Bush, D;Udayakumar, A",IB 103,-1.0,3.125384615384615,https://www.reddit.com/r/UIUC/search/?q=IB103&type=link&cId=b32ceb77-1b8c-40e5-8b34-d2b4fec8c4b6&iId=bfd40497-f1e5-4941-9509-aa6fccd80b9e
225,2024,Spring,IB,108,The Biology of Dinosaurs,"The origin, diversity, and extinction of dinosaurs will serve as a conceptual framework to explore fundamental principles of biology. We will consider dinosaurs as animals, examining evidence for their physiology and behavior, and how evolution and speciation produced the diversity of dinosaurs. We will relate the influence of Earth's changing environments on dinosaurs to environmental change on human timescales. We will emphasize how scientists collect and evaluate fossil data through an understanding of living organisms.",3 hours.,Nat Sci & Tech - Life Sciences course.,Online Lecture,ARRANGED,,,"Manaster, J",IB 108,4.4,3.232878787878788,https://www.reddit.com/r/UIUC/search/?q=IB108&type=link&cId=b32ceb77-1b8c-40e5-8b34-d2b4fec8c4b6&iId=bfd40497-f1e5-4941-9509-aa6fccd80b9e
226,2024,Spring,IB,150,Organismal &amp; Evolutionary Biol,"Introduction to physiology, genetics, and evolution of organisms, and their ecology and diversity.",4 hours.,Nat Sci & Tech - Life Sciences course.,Lecture,09:30 AM,10:50 AM,TR,"Chamberlain, M;Clegg, B",IB 150,-1.0,2.960143129770992,https://www.reddit.com/r/UIUC/search/?q=IB150&type=link&cId=b32ceb77-1b8c-40e5-8b34-d2b4fec8c4b6&iId=bfd40497-f1e5-4941-9509-aa6fccd80b9e
227,2024,Spring,IB,271,Organismal Biology,"Integrated study of the diversity and structure and function of plants and animals in evolutionary and environmental contexts. Conceptual themes and techniques of molecular and cellular levels of biological organization will be integrated as well. Lecture and laboratory. The laboratory includes vertebrate dissection. Credit is not given for both IB 271 and IB 202. Prerequisite: IB 150, MCB 150, and IB 270; good standing in the honors biology option.",5 hours.,Advanced Composition course.,Lecture,11:00 AM,11:50 AM,MWF,"Chen, L;Cheng-De Vries, C",IB 271,1.6,3.9134782608695655,https://www.reddit.com/r/UIUC/search/?q=IB271&type=link&cId=b32ceb77-1b8c-40e5-8b34-d2b4fec8c4b6&iId=bfd40497-f1e5-4941-9509-aa6fccd80b9e
228,2024,Spring,INFO,303,Writing Across Media,"The ability to communicate effectively in multiple types of media is a crucial part of literacy in our society. In this course, students will explore the intersections of various media: print, film, images, sound, etc. Students will consider the ways in which writing--as an object and as a practice--is shaped by multimodal interactions. Also integrates practical activities with broader theoretical issues in order to provide effective strategies for designing multimedia presentations, projects, and texts that integrate photography, video, and sound. Same as WRIT 303.",3 hours.,Advanced Composition course.,Lecture,09:30 AM,10:45 AM,TR,"Gross, H",INFO 303,4.7,,https://www.reddit.com/r/UIUC/search/?q=INFO303&type=link&cId=b32ceb77-1b8c-40e5-8b34-d2b4fec8c4b6&iId=bfd40497-f1e5-4941-9509-aa6fccd80b9e
229,2024,Spring,IS,101,Introduction to Information Sciences,"This course provides an introduction to the field of information science and the major. It offers both historical and contemporary context for understanding the role of information in society. Focus is placed upon critical analysis of information problems as well as understanding the creation, use, and distribution of information in business, policy, education, government, health, and other sectors.",3 hours.,Social & Beh Sci - Soc Sci course.,Online Lecture,12:30 PM,01:50 PM,T,"Pintar, J",IS 101,4.8,3.863867924528302,https://www.reddit.com/r/UIUC/search/?q=IS101&type=link&cId=b32ceb77-1b8c-40e5-8b34-d2b4fec8c4b6&iId=bfd40497-f1e5-4941-9509-aa6fccd80b9e
230,2024,Spring,IS,202,Social Aspects Info Tech,"Explores the way in which information technologies have and are transforming society and how these affect a range of social, political and economic issues from the individual to societal levels. Same as INFO 202 and MACS 202.",3 hours.,Social & Beh Sci - Soc Sci course.,Lecture,11:00 AM,11:50 AM,MW,"Oh, S;Sun, M",IS 202,2.0,3.74260663507109,https://www.reddit.com/r/UIUC/search/?q=IS202&type=link&cId=b32ceb77-1b8c-40e5-8b34-d2b4fec8c4b6&iId=bfd40497-f1e5-4941-9509-aa6fccd80b9e
231,2024,Spring,IS,203,Analytical Foundations for Information Problems,"A survey of mathematical topics for students in information sciences. Provides an introduction to sets, relations, graphs, grammars, probability, and propositional and predicate logic. These topics relate to applications in information modeling, representation and expression. Prerequisite: MATH 112 or Required ALEKS Score.",3 hours.,Quantitative Reasoning II course.,Lecture-Discussion,10:00 AM,10:50 AM,MWF,"Batzloff, B",IS 203,4.5,3.160621468926553,https://www.reddit.com/r/UIUC/search/?q=IS203&type=link&cId=b32ceb77-1b8c-40e5-8b34-d2b4fec8c4b6&iId=bfd40497-f1e5-4941-9509-aa6fccd80b9e
232,2024,Spring,IS,305,Programming for Information Problems II,"Continuing coverage of common data processing and computing methods in the information sciences. Building on programming skills from IS 205, additional programming patterns will be explored, and additional tools like the command line and version control will be explored in the context of information problems. Course will be in Python. Some Python review will be provided, but students without prior experience in Python should contact the school or instructor for review material. Prerequisite: IS 205, or CS 101, or CS 105, or CS 125, or ECE 120, or equivalent. Basic programming (Python) proficiency required.",3 hours.,Quantitative Reasoning I course.,Lecture-Discussion,10:00 AM,11:20 AM,MW,"Wickes, E",IS 305,5.0,,https://www.reddit.com/r/UIUC/search/?q=IS305&type=link&cId=b32ceb77-1b8c-40e5-8b34-d2b4fec8c4b6&iId=bfd40497-f1e5-4941-9509-aa6fccd80b9e
233,2024,Spring,IS,312,Reading and Writing Data,"Explores how we tell stories and make arguments in the age of the internet and ""big data."" We will explore both creative and scholarly works that experiment with the forms of expression that digital and online media make possible, and others that question the cultural, political, and social consequences of computational media and data. Students will develop skills for writing _about data_ and writing _with data_ through a variety of media.",3 hours.,"Advanced Composition, and Humanities - Lit & Arts course.",Lecture-Discussion,03:30 PM,04:50 PM,TR,"Kollmer, M",IS 312,0.0,3.5,https://www.reddit.com/r/UIUC/search/?q=IS312&type=link&cId=b32ceb77-1b8c-40e5-8b34-d2b4fec8c4b6&iId=bfd40497-f1e5-4941-9509-aa6fccd80b9e
234,2024,Spring,JOUR,200,Introduction to Journalism,"Discussion of the history, freedom, technologies, ethics, and functions of the news media. Training in clear, descriptive writing techniques, using journalistic models.",3 hours.,Advanced Composition course.,Online,ARRANGED,,,"Ng, Y",JOUR 200,5.0,3.2820321931589533,https://www.reddit.com/r/UIUC/search/?q=JOUR200&type=link&cId=b32ceb77-1b8c-40e5-8b34-d2b4fec8c4b6&iId=bfd40497-f1e5-4941-9509-aa6fccd80b9e
235,2024,Spring,JOUR,205,History of American Journalism,"Surveys the history of the field of journalism since pre-colonial times. Includes the evolution of the media in the United States and the evolution of cultural concepts concerning the media, including rights granted under the First Amendment.",3 hours.,Humanities - Hist & Phil course.,Lecture-Discussion,11:00 AM,12:20 PM,TR,"Craft, S",JOUR 205,4.5,3.27156862745098,https://www.reddit.com/r/UIUC/search/?q=JOUR205&type=link&cId=b32ceb77-1b8c-40e5-8b34-d2b4fec8c4b6&iId=bfd40497-f1e5-4941-9509-aa6fccd80b9e
236,2024,Spring,JOUR,451,Research Methods in Journalism,"Introduction to social science principles of measurement, sampling, statistical inferences and logic of research design in collection, analysis and interpretation of information used in journalism and mass media. 3 undergraduate hours. 3 graduate hours. Prerequisite: Completion of Quantitative Reasoning I requirement.",3 hours.,Quantitative Reasoning II course.,Lecture-Discussion,03:30 PM,04:50 PM,TR,"Ball, C",JOUR 451,-1.0,3.752931034482759,https://www.reddit.com/r/UIUC/search/?q=JOUR451&type=link&cId=b32ceb77-1b8c-40e5-8b34-d2b4fec8c4b6&iId=bfd40497-f1e5-4941-9509-aa6fccd80b9e
237,2024,Spring,KIN,140,Social Sci of Human Movement,Introduction to the social scientific aspects of human movement including sport; particular emphasis on concepts derived from the social sciences (including psychology) that are appropriate to human movement.,3 hours.,Social & Beh Sci - Soc Sci course.,Lecture,09:00 AM,09:50 AM,MW,"Pindus, D",KIN 140,2.5,3.493849206349206,https://www.reddit.com/r/UIUC/search/?q=KIN140&type=link&cId=b32ceb77-1b8c-40e5-8b34-d2b4fec8c4b6&iId=bfd40497-f1e5-4941-9509-aa6fccd80b9e
238,2024,Spring,KIN,150,Bioscience of Human Movement,"Integrates anatomical and physiological aspects of human movement; emphasizes how the body moves, physiological responses to exercise stress, physical conditioning and physical fitness. Additional fees may apply. See Class Schedule.",3 hours.,Nat Sci & Tech - Life Sciences course.,Lecture,12:00 PM,12:50 PM,MW,"Boppart, M",KIN 150,3.6,3.036290322580645,https://www.reddit.com/r/UIUC/search/?q=KIN150&type=link&cId=b32ceb77-1b8c-40e5-8b34-d2b4fec8c4b6&iId=bfd40497-f1e5-4941-9509-aa6fccd80b9e
239,2024,Spring,KIN,201,Physical Activity Research Methods,"This course provides an introduction of physical activity measurement and methods. The course will focus on (a) defining physical activity and associated terms and concepts; (b) providing detailed understanding of approaches and tools for measuring physical activity; and (c) facilitating understanding of scientific methods for physical activity research (e.g., experimental and non-experimental designs).",3 hours.,Quantitative Reasoning II course.,Lecture-Discussion,01:00 PM,01:50 PM,MW,"Miranda Tassitano, R",KIN 201,-1.0,3.597067669172932,https://www.reddit.com/r/UIUC/search/?q=KIN201&type=link&cId=b32ceb77-1b8c-40e5-8b34-d2b4fec8c4b6&iId=bfd40497-f1e5-4941-9509-aa6fccd80b9e
240,2024,Spring,KIN,249,Sport &amp; Modern Society,"The sociological analysis of sport in modern societies with regard to social class, politics, community, education, and collective behavior.",3 hours.,Social & Beh Sci - Soc Sci course.,Online,ARRANGED,,,"Haugen, M;Schwingel, A",KIN 249,-1.0,3.741660839160839,https://www.reddit.com/r/UIUC/search/?q=KIN249&type=link&cId=b32ceb77-1b8c-40e5-8b34-d2b4fec8c4b6&iId=bfd40497-f1e5-4941-9509-aa6fccd80b9e
