,Year,Term,Subject,Number,Name,Description,Credit Hours,Degree Attributes,Type,Start Time,End Time,Days of Week,Instructors,Class,ProfRating,GPA,Reddit_Links
276,2024,Spring,MATH,220,Calculus,"First course in calculus and analytic geometry; basic techniques of differentiation and integration with applications including curve sketching; antidifferentation, the Riemann integral, fundamental theorem, exponential and trigonometric functions. Credit is not given for both MATH 220 and either MATH 221 or MATH 234. Prerequisite: An adequate ALEKS placement score as described at http://math.illinois.edu/ALEKS/, demonstrating knowledge of topics of MATH 115. Students with previous calculus experience should consider MATH 221.",5 hours.,Quantitative Reasoning I course.,Lecture,09:00 AM,09:50 AM,MWF,"Hoffmeister, A",MATH 220,5.0,2.719806547619048,https://www.reddit.com/r/UIUC/search/?q=MATH220&type=link&cId=b32ceb77-1b8c-40e5-8b34-d2b4fec8c4b6&iId=bfd40497-f1e5-4941-9509-aa6fccd80b9e
277,2024,Spring,MATH,231,Calculus II,"Second course in calculus and analytic geometry: techniques of integration, conic sections, polar coordinates, and infinite series. Prerequisite: MATH 220 or MATH 221.",3 hours.,Quantitative Reasoning I course.,Lecture,08:00 AM,08:50 AM,TR,"Guo, M",MATH 231,-1.0,3.1642949607027275,https://www.reddit.com/r/UIUC/search/?q=MATH231&type=link&cId=b32ceb77-1b8c-40e5-8b34-d2b4fec8c4b6&iId=bfd40497-f1e5-4941-9509-aa6fccd80b9e
278,2024,Spring,MATH,234,Calculus for Business I,"Introduction to the concept of functions and the basic ideas of the calculus. Credit is not given for both MATH 234 and either MATH 220 or MATH 221. Prerequisite: An adequate ALEKS placement score as described at http://math.illinois.edu/ALEKS/, demonstrating knowledge of the topics of MATH 112.",4 hours.,Quantitative Reasoning I course.,Lecture,12:00 PM,12:50 PM,MW,"Zeiser, F",MATH 234,-1.0,3.1093200000000003,https://www.reddit.com/r/UIUC/search/?q=MATH234&type=link&cId=b32ceb77-1b8c-40e5-8b34-d2b4fec8c4b6&iId=bfd40497-f1e5-4941-9509-aa6fccd80b9e
279,2024,Spring,MATH,241,Calculus III,"Third course in calculus and analytic geometry including vector analysis: Euclidean space, partial differentiation, multiple integrals, line integrals and surface integrals, the integral theorems of vector calculus. Credit is not given for both MATH 241 and MATH 292. Prerequisite: MATH 231.",4 hours.,Quantitative Reasoning II course.,Lecture,10:00 AM,10:50 AM,MWF,"Russell, M",MATH 241,5.0,2.991244113029828,https://www.reddit.com/r/UIUC/search/?q=MATH241&type=link&cId=b32ceb77-1b8c-40e5-8b34-d2b4fec8c4b6&iId=bfd40497-f1e5-4941-9509-aa6fccd80b9e
280,2024,Spring,MATH,285,Intro Differential Equations,"Techniques and applications of ordinary differential equations, including Fourier series and boundary value problems, and an introduction to partial differential equations. Intended for engineering majors and others who require a working knowledge of differential equations. Credit is not given for both MATH 285 and any of MATH 284, MATH 286, MATH 441. Prerequisite: MATH 241.",3 hours.,Quantitative Reasoning II course.,Online,08:00 AM,08:50 AM,MWF,"Albin, P",MATH 285,5.0,3.465422149122807,https://www.reddit.com/r/UIUC/search/?q=MATH285&type=link&cId=b32ceb77-1b8c-40e5-8b34-d2b4fec8c4b6&iId=bfd40497-f1e5-4941-9509-aa6fccd80b9e
281,2024,Spring,MCB,100,Introductory Microbiology,"Introduction to the principal activities and properties of microorganisms, including bacteria, yeasts, molds, and viruses; consideration of the role of natural processes, such as photosynthesis; and man's use and control of microorganisms in the production of antibodies and vaccines in industrial fermentations, in sanitation and public health, and in agriculture. Credit is not given for both MCB 100 and MCB 300. Prerequisite: There are no prerequisites for MCB 100, but some chemistry is recommended.",3 hours.,Nat Sci & Tech - Life Sciences course.,Lecture,02:00 PM,02:50 PM,MWF,"Kirchner, N;Radin, J;Wilson, B",MCB 100,0.0,3.221148325358852,https://www.reddit.com/r/UIUC/search/?q=MCB100&type=link&cId=b32ceb77-1b8c-40e5-8b34-d2b4fec8c4b6&iId=bfd40497-f1e5-4941-9509-aa6fccd80b9e
282,2024,Spring,ME,470,Senior Design Project,"Solution of a real-world design problem: development, evaluation, and recommendation of alternative solutions subject to realistic constraints that include most of the following considerations: economics, environment, sustainability, manufacturability, ethics, health and safety, society, and politics. 3 undergraduate hours. No graduate credit. Prerequisite: Concurrent enrollment in no more than two required ME courses; completion of all required courses for ME students. Concurrent enrollment in no more than two required TAM courses; completion of all required courses for EM students. Departmental approval required. Restricted to students in the Mechanical Sci & Engineering department. Restricted to students with Senior class standing.",3 hours.,Advanced Composition course.,Lecture,08:00 AM,09:50 AM,T,"Johnson, B",ME 470,3.8,3.883870967741936,https://www.reddit.com/r/UIUC/search/?q=ME470&type=link&cId=b32ceb77-1b8c-40e5-8b34-d2b4fec8c4b6&iId=bfd40497-f1e5-4941-9509-aa6fccd80b9e
283,2024,Spring,MSE,308,Materials Laboratory II,"Experiments characterizing mechanical, transport, and electronic properties of materials and the use of optical microscopy, quartz crystal microbalance, and various mechanical testing equipment. Technical communication is refined through the use of lab reports and oral presentations. MSE 307 and MSE 308 are approved for General Education credit only as a sequence. Both courses must be completed to receive Advanced Composition credit. Prerequisite: Credit or concurrent registration in MSE 307 and MSE 406.",3 hours.,Advanced Composition course.,Lecture,01:00 PM,01:50 PM,TR,"TerBush, J",MSE 308,-1.0,3.317118644067796,https://www.reddit.com/r/UIUC/search/?q=MSE308&type=link&cId=b32ceb77-1b8c-40e5-8b34-d2b4fec8c4b6&iId=bfd40497-f1e5-4941-9509-aa6fccd80b9e
284,2024,Spring,MUS,132,Popular Music Studies,"Courses within this rubric provide an analytical and historical introduction to genres of popular music from the United States and around the world. Iterations of the course may focus on a specific genre, such as Rock, Reggae, or Afropop, or may deal with broader subjects, such as the continua of styles including R&B, Soul, Funk, and Hip Hop, or the pan-generic, international phenomenon of pop music globalization in the twentieth century.",3 hours.,"Humanities - Lit & Arts, and Cultural Studies - US Minority course.",Lecture,03:00 PM,03:50 PM,MW,"Vallier, N",MUS 132,-1.0,3.799290012033695,https://www.reddit.com/r/UIUC/search/?q=MUS132&type=link&cId=b32ceb77-1b8c-40e5-8b34-d2b4fec8c4b6&iId=bfd40497-f1e5-4941-9509-aa6fccd80b9e
285,2024,Spring,MUS,133,Introduction to World Music,A survey of various musical traditions from different regions and peoples of the world.,3 hours.,"Humanities - Lit & Arts, and Cultural Studies - Non-West course.",Lecture,12:00 PM,12:50 PM,TR,"Smith, J",MUS 133,2.3,3.78093489148581,https://www.reddit.com/r/UIUC/search/?q=MUS133&type=link&cId=b32ceb77-1b8c-40e5-8b34-d2b4fec8c4b6&iId=bfd40497-f1e5-4941-9509-aa6fccd80b9e
286,2024,Spring,MUS,209,Musical Acoustics,"Musical Acoustics is a broad introductory course that presents the fundamentals of acoustics and psychoacoustics, contextualized and reinforced through practical applications in music and creative audio. Topics include the physical properties of sound, wave mechanics and propagation, acoustic measurements, perceptual properties of sound, and acoustical properties of physical spaces. Students will develop a mathematical understanding of sound, and learn to apply that knowledge to solve problems in a variety of technical and creative situations.",3 hours.,Nat Sci & Tech - Phys Sciences course.,Lecture-Discussion,02:00 PM,03:20 PM,TR,"Davenport, X",MUS 209,-1.0,,https://www.reddit.com/r/UIUC/search/?q=MUS209&type=link&cId=b32ceb77-1b8c-40e5-8b34-d2b4fec8c4b6&iId=bfd40497-f1e5-4941-9509-aa6fccd80b9e
287,2024,Spring,MUS,314,The History of Music II,Survey of the development of music as an art in Western civilization from about 1750 to the present. Emphasizes an acquaintance with formal and stylistic problems through the study of representative works and on understanding specific musical concepts in the light of their historical and general cultural context. Prerequisite: MUS 313 or consent of instructor.,3 hours.,Humanities - Lit & Arts course.,Lecture,11:00 AM,11:50 AM,MWF,"Eagen-Jones, M",MUS 314,5.0,3.1329545454545453,https://www.reddit.com/r/UIUC/search/?q=MUS314&type=link&cId=b32ceb77-1b8c-40e5-8b34-d2b4fec8c4b6&iId=bfd40497-f1e5-4941-9509-aa6fccd80b9e
288,2024,Spring,MUSE,250,The World Through Museums,"Examination of contemporary museums around the world, evaluating their roles as social institutions and communicators of heritage in increasingly global contexts. The first half of the course develops a framework for museum literacy (how to read museums) that incorporates anthropological, globalization, media and critical theories. The second half of the course is a virtual tour and evaluates museums using this analytical skill set. Same as ANTH 250.",3 hours.,"Grand Challenge-Inequality, Social & Beh Sci - Soc Sci, and Cultural Studies - Western course.",Lecture-Discussion,10:00 AM,10:50 AM,MWF,"Frankenberg, S",MUSE 250,3.8,3.4896875,https://www.reddit.com/r/UIUC/search/?q=MUSE250&type=link&cId=b32ceb77-1b8c-40e5-8b34-d2b4fec8c4b6&iId=bfd40497-f1e5-4941-9509-aa6fccd80b9e
289,2024,Spring,NPRE,101,Introduction to Energy Sources,"Explanation of energy technologies using an elementary approach presupposing no prior scientific or technical background. Coverage of all energy sources including fossil fueled, solar, hydro, and nuclear power. Integral demonstrations and a tour of the University's power plant. Discussion of energy related incidents with emphasis on environmental, economic, and social impact. Same as ENVS 101.",3 hours.,"Nat Sci & Tech - Phys Sciences, and Quantitative Reasoning II course.",Lecture,03:00 PM,03:50 PM,MWF,"Andruczyk, D",NPRE 101,-1.0,3.0691666666666664,https://www.reddit.com/r/UIUC/search/?q=NPRE101&type=link&cId=b32ceb77-1b8c-40e5-8b34-d2b4fec8c4b6&iId=bfd40497-f1e5-4941-9509-aa6fccd80b9e
290,2024,Spring,NRES,100,Fundamentals of Env Sci,"Introduction to environmental sciences and current environment issues. Topics include population growth, world food supplies, agriculture and the environment, biodiversity, fossil fuels and ""green"" energy issues, endangered and threatened species, water use, conservation and pollution, global warming, acid rain, ozone depletion, waste management and reduction, recycling, toxins and health, mineral resources, and environmental policies and regulations. Course addresses the complex relationships between the human race and the natural systems that contain our air, water, energy, and biotic and food resources. Credit is not given for both NRES 100 and NRES 102.",3 hours.,Nat Sci & Tech - Phys Sciences course.,Online,ARRANGED,,,"Ugarte Diaz, C",NRES 100,-1.0,3.1673838630806848,https://www.reddit.com/r/UIUC/search/?q=NRES100&type=link&cId=b32ceb77-1b8c-40e5-8b34-d2b4fec8c4b6&iId=bfd40497-f1e5-4941-9509-aa6fccd80b9e
291,2024,Spring,NRES,101,Wildlife Conservation in the 21st Century,"An introduction to the conservation, diversity and ecology of animals. The diversity of fish, reptiles, amphibians, mammals, and birds both around the world and in Illinois will be explored. The course will have a strong conservation component where students are introduced to a variety of threats facing animals. The students will be introduced to how to manage sustainable wildlife populations. The students will be exposed to current issues in Illinois to illustrate how people and animals can co-occur and a broad overview of the management, restoration, and conservation techniques.",3 hours.,Nat Sci & Tech - Life Sciences course.,Online,ARRANGED,,,"Dorman, W;Stickley, S",NRES 101,-1.0,3.583560606060606,https://www.reddit.com/r/UIUC/search/?q=NRES101&type=link&cId=b32ceb77-1b8c-40e5-8b34-d2b4fec8c4b6&iId=bfd40497-f1e5-4941-9509-aa6fccd80b9e
292,2024,Spring,NRES,105,Climate Change Impacts on Ecological Systems,"Examines the response of ecological systems to climate change by drawing on multiple lines of evidence from the past and present. Topics include species range shifts, timing of biological events, ecosystem function, and feedbacks. The implications for conservation, as well as approaches to mitigating and adapting to climate change, are also explored. Computer-based exercises are used to enhance quantitative reasoning skills and build climate and ecological literacy. Online only.",3 hours.,"Nat Sci & Tech - Life Sciences, and Quantitative Reasoning II course.",Online,ARRANGED,,,"Fraterrigo, J",NRES 105,4.3,2.969517543859649,https://www.reddit.com/r/UIUC/search/?q=NRES105&type=link&cId=b32ceb77-1b8c-40e5-8b34-d2b4fec8c4b6&iId=bfd40497-f1e5-4941-9509-aa6fccd80b9e
293,2024,Spring,NRES,287,Environment and Society,"Examination of the relationship between environment and society and implications for ecological and human well-being. Social science perspective covered on topics such as environmental change, environmental decision-making, natural resource management, agricultural systems, and environmental risks, hazards, and disasters. Students will build critical thinking skills focused on contemporary problems in the interface between people and the physical environment. Same as ESE 287, GGIS 287, and PS 273. Prerequisite: NRES 102 and sophomore or higher standing. Introductory social science course recommended.",3 hours.,"Social & Beh Sci - Soc Sci, and Cultural Studies - Western course.",Lecture,01:00 PM,01:50 PM,MW,"Van Riper, C",NRES 287,4.2,3.401008403361345,https://www.reddit.com/r/UIUC/search/?q=NRES287&type=link&cId=b32ceb77-1b8c-40e5-8b34-d2b4fec8c4b6&iId=bfd40497-f1e5-4941-9509-aa6fccd80b9e
294,2024,Spring,NRES,419,Env and Plant Ecosystems,Relationships among environmental factors and plant processes and functions; impact of human activities on the environment and the structure and function of plant ecosystems. Examples will be drawn from a variety of managed and unmanaged plant ecosystems. 3 undergraduate hours. 3 graduate hours. Prerequisite: NRES 219 or LA 450 or IB 103 and CHEM 104 or NRES 201.,3 hours.,Advanced Composition course.,Online,06:00 PM,09:00 PM,T,"Carpenter, L",NRES 419,-1.0,3.177941176470588,https://www.reddit.com/r/UIUC/search/?q=NRES419&type=link&cId=b32ceb77-1b8c-40e5-8b34-d2b4fec8c4b6&iId=bfd40497-f1e5-4941-9509-aa6fccd80b9e
295,2024,Spring,PHIL,100,Intro to Philosophy-ACP,"Consideration of some main problems of philosophy concerning, for example, knowledge, God, mind and body, and human freedom. Course is identical to PHIL 101 except for the additional writing component. Credit is not given for both PHIL 100 and PHIL 101. Prerequisite: Completion of campus Composition I general education requirement.",3 hours.,"Advanced Composition, and Humanities - Hist & Phil course.",Lecture,11:00 AM,11:50 AM,MW,"Saenz, N",PHIL 100,4.5,,https://www.reddit.com/r/UIUC/search/?q=PHIL100&type=link&cId=b32ceb77-1b8c-40e5-8b34-d2b4fec8c4b6&iId=bfd40497-f1e5-4941-9509-aa6fccd80b9e
296,2024,Spring,PHIL,101,Introduction to Philosophy,"Consideration of some main problems of philosophy concerning, for example, knowledge, God, mind and body, and human freedom. Credit is not given for both PHIL 101 and PHIL 100.",3 hours.,Humanities - Hist & Phil course.,Lecture-Discussion,09:00 AM,09:50 AM,MWF,"Durso, D",PHIL 101,0.0,3.1346753246753245,https://www.reddit.com/r/UIUC/search/?q=PHIL101&type=link&cId=b32ceb77-1b8c-40e5-8b34-d2b4fec8c4b6&iId=bfd40497-f1e5-4941-9509-aa6fccd80b9e
297,2024,Spring,PHIL,102,Logic and Reasoning,"Practical study of logical reasoning; techniques for analyzing and criticizing arguments, with emphasis on assessing the logical coherence of what we read and write.",3 hours.,Humanities - Hist & Phil course.,Lecture-Discussion,11:00 AM,11:50 AM,MWF,"Louzon, N",PHIL 102,-1.0,2.9007792207792207,https://www.reddit.com/r/UIUC/search/?q=PHIL102&type=link&cId=b32ceb77-1b8c-40e5-8b34-d2b4fec8c4b6&iId=bfd40497-f1e5-4941-9509-aa6fccd80b9e
298,2024,Spring,PHIL,103,Logic and Reasoning QR II,"Practical study of logical reasoning; techniques for analyzing and criticizing arguments, with emphasis on assessing the logical coherence of what we read and write. Credit is not given for both PHIL 103 and PHIL 102.",3 hours.,"Humanities - Hist & Phil, and Quantitative Reasoning II course.",Lecture-Discussion,10:00 AM,10:50 AM,TR,"Kerr, A",PHIL 103,-1.0,3.348636363636364,https://www.reddit.com/r/UIUC/search/?q=PHIL103&type=link&cId=b32ceb77-1b8c-40e5-8b34-d2b4fec8c4b6&iId=bfd40497-f1e5-4941-9509-aa6fccd80b9e
299,2024,Spring,PHIL,104,Intro to Ethics-ACP,"Some basic questions of ethics, discussed in the light of influential ethical theories and with reference to specific moral problems, such as: What makes an action morally right? Are moral standards absolute or relative? What is relation between personal morality and social morality, and between social morality and law? Course is identical to PHIL 105 except for the additional writing component. Credit is not given for both PHIL 104 and either PHIL 105 or PHIL 106. Prerequisite: Completion of campus Composition I general education requirement.",3 hours.,"Advanced Composition, and Humanities - Hist & Phil course.",Lecture,11:00 AM,11:50 AM,TR,"Bojanowski, J",PHIL 104,0.0,3.777619047619048,https://www.reddit.com/r/UIUC/search/?q=PHIL104&type=link&cId=b32ceb77-1b8c-40e5-8b34-d2b4fec8c4b6&iId=bfd40497-f1e5-4941-9509-aa6fccd80b9e
300,2024,Spring,PHIL,105,Introduction to Ethics,"Some basic questions of ethics, discussed in the light of influential ethical theories and with reference to specific moral problems, such as: what makes an action morally right? are moral standards absolute or relative? what is the relation between personal morality and social morality, and between social morality and law? Credit is not given for both PHIL 105 and either PHIL 104 or PHIL 106.",3 hours.,Humanities - Hist & Phil course.,Lecture-Discussion,12:00 PM,12:50 PM,MWF,"Carlson, A",PHIL 105,-1.0,,https://www.reddit.com/r/UIUC/search/?q=PHIL105&type=link&cId=b32ceb77-1b8c-40e5-8b34-d2b4fec8c4b6&iId=bfd40497-f1e5-4941-9509-aa6fccd80b9e
301,2024,Spring,PHIL,106,Ethics and Social Policy,"Examination of the moral aspects of social problems, and a survey of ethical principles formulated to validate social policy. Credit is not given for both PHIL 106 and either PHIL 104 or PHIL 105.",3 hours.,Social & Beh Sci - Soc Sci course.,Lecture,01:00 PM,02:20 PM,TR,"Jensen, E",PHIL 106,5.0,,https://www.reddit.com/r/UIUC/search/?q=PHIL106&type=link&cId=b32ceb77-1b8c-40e5-8b34-d2b4fec8c4b6&iId=bfd40497-f1e5-4941-9509-aa6fccd80b9e
302,2024,Spring,PHIL,202,Symbolic Logic,"Introduction to the techniques of formal logic, dealing primarily with truth-functional logic and quantification theory.",3 hours.,Quantitative Reasoning I course.,Online,ARRANGED,,,"Bruckler, S;Kim, H;Lee, S",PHIL 202,-1.0,2.410350877192983,https://www.reddit.com/r/UIUC/search/?q=PHIL202&type=link&cId=b32ceb77-1b8c-40e5-8b34-d2b4fec8c4b6&iId=bfd40497-f1e5-4941-9509-aa6fccd80b9e
303,2024,Spring,PHIL,203,Ancient Philosophy,"Introduction to ancient philosophy, concentrating on Plato and Aristotle, dealing with such topics as metaphysics, ethics, and the theory of knowledge. Same as CLCV 203.",4 hours.,Humanities - Hist & Phil course.,Lecture-Discussion,03:00 PM,04:20 PM,TR,"Biondi, Z;Chacon Moreno, A",PHIL 203,2.0,3.358130081300813,https://www.reddit.com/r/UIUC/search/?q=PHIL203&type=link&cId=b32ceb77-1b8c-40e5-8b34-d2b4fec8c4b6&iId=bfd40497-f1e5-4941-9509-aa6fccd80b9e
304,2024,Spring,PHIL,206,Early Modern Philosophy,"The history of philosophy from Descartes to Kant, concentrating on such topics as metaphysics, ethics, and the theory of knowledge.",4 hours.,Humanities - Hist & Phil course.,Lecture-Discussion,12:30 PM,01:50 PM,TR,"Nowakowski, P;Weinberg, S",PHIL 206,-1.0,3.2603296703296705,https://www.reddit.com/r/UIUC/search/?q=PHIL206&type=link&cId=b32ceb77-1b8c-40e5-8b34-d2b4fec8c4b6&iId=bfd40497-f1e5-4941-9509-aa6fccd80b9e
305,2024,Spring,PHIL,222,Philosophical Foundations of Computer Science,"Introduction to certain ideas and issues at the intersection of computer science and philosophy. Students will focus on foundational questions related to the birth of computer science as a discipline, philosophical issues regarding knowledge and reality that researchers face in the frontiers of contemporary computer science, and current ethical issues related to the uses of machines and computers in society.",3 hours.,Humanities - Hist & Phil course.,Lecture-Discussion,04:00 PM,05:20 PM,MW,"Currie, B;Lee, S",PHIL 222,-1.0,3.700847457627119,https://www.reddit.com/r/UIUC/search/?q=PHIL222&type=link&cId=b32ceb77-1b8c-40e5-8b34-d2b4fec8c4b6&iId=bfd40497-f1e5-4941-9509-aa6fccd80b9e
306,2024,Spring,PHIL,223,Minds &amp; Machines,"Introduction to certain ideas and issues at the intersection of computer science and philosophy. Students will focus on the nature of human minds and brains in light of what we know about machine “minds” and “hardware” (and vice versa), as well as on philosophical considerations of the societal effects and implications of the rise of intelligent machines.",3 hours.,Humanities - Hist & Phil course.,Lecture-Discussion,01:00 PM,01:50 PM,MWF,"Estrup, A;Scharp, K",PHIL 223,-1.0,2.777843137254901,https://www.reddit.com/r/UIUC/search/?q=PHIL223&type=link&cId=b32ceb77-1b8c-40e5-8b34-d2b4fec8c4b6&iId=bfd40497-f1e5-4941-9509-aa6fccd80b9e
307,2024,Spring,PHIL,250,Conceptions of Human Nature,Comparative examination of important historical and contemporary conceptions of human nature.,3 hours.,Humanities - Hist & Phil course.,Lecture-Discussion,03:30 PM,04:50 PM,TR,"Vanderbeek, R",PHIL 250,5.0,,https://www.reddit.com/r/UIUC/search/?q=PHIL250&type=link&cId=b32ceb77-1b8c-40e5-8b34-d2b4fec8c4b6&iId=bfd40497-f1e5-4941-9509-aa6fccd80b9e
308,2024,Spring,PHIL,454,Advanced Symbolic Logic,"Completeness, compactness, and Lowenheim-Skolem theorems for first-order logic; incompleteness and undecidability of formal systems; and additional material on proof theory, model theory, or axiomatic set theory as time permits. 3 undergraduate hours. 3 or 4 graduate hours. Prerequisite: PHIL 202 or consent of instructor.",3 OR 4 hours.,Quantitative Reasoning II course.,Lecture-Discussion,11:00 AM,12:20 PM,TR,"Kishida, K",PHIL 454,5.0,3.4308333333333336,https://www.reddit.com/r/UIUC/search/?q=PHIL454&type=link&cId=b32ceb77-1b8c-40e5-8b34-d2b4fec8c4b6&iId=bfd40497-f1e5-4941-9509-aa6fccd80b9e
309,2024,Spring,PHYS,101,College Physics: Mech &amp; Heat,"Newton's Laws, work and energy, rotational motion, fluids, thermodynamics, and waves. A noncalculus-based approach for majors in the life sciences, preprofessional health programs, agriculture, and veterinary medicine. Credit is not given for both PHYS 101 and either PHYS 211 or PHYS 213. Prerequisite: Trigonometry.",5 hours.,"Nat Sci & Tech - Phys Sciences, and Quantitative Reasoning II course.",Lecture,09:00 AM,09:50 AM,MW,"Ansell, K",PHYS 101,2.0,2.916601941747573,https://www.reddit.com/r/UIUC/search/?q=PHYS101&type=link&cId=b32ceb77-1b8c-40e5-8b34-d2b4fec8c4b6&iId=bfd40497-f1e5-4941-9509-aa6fccd80b9e
310,2024,Spring,PHYS,102,College Physics: E&amp;M &amp; Modern,"Electric forces and fields, electric potential, electric circuits, magnetic forces and fields, geometrical optics, relativity,  and modern physics. A noncalculus-based approach for majors in the life sciences, preprofessional health programs, agriculture, and veterinary medicine. Credit is not given for both PHYS 102 and either PHYS 212 or PHYS 214. Prerequisite: PHYS 101.",5 hours.,"Nat Sci & Tech - Phys Sciences, and Quantitative Reasoning II course.",Lecture,01:00 PM,01:50 PM,MW,"Holder, G",PHYS 102,4.5,3.062849557522124,https://www.reddit.com/r/UIUC/search/?q=PHYS102&type=link&cId=b32ceb77-1b8c-40e5-8b34-d2b4fec8c4b6&iId=bfd40497-f1e5-4941-9509-aa6fccd80b9e
311,2024,Spring,PHYS,211,University Physics: Mechanics,"Newton's Laws, work and energy, static properties and fluids, oscillations, transverse waves, systems of particles, and rotations. A calculus-based approach for majors in engineering, mathematics, physics and chemistry. Credit is not given for both PHYS 211 and PHYS 101. Prerequisite: Credit or concurrent registration in MATH 231.",4 hours.,"Nat Sci & Tech - Phys Sciences, and Quantitative Reasoning II course.",Lecture,09:00 AM,09:50 AM,TR,"Stelzer, T",PHYS 211,5.0,3.0564647577092505,https://www.reddit.com/r/UIUC/search/?q=PHYS211&type=link&cId=b32ceb77-1b8c-40e5-8b34-d2b4fec8c4b6&iId=bfd40497-f1e5-4941-9509-aa6fccd80b9e
312,2024,Spring,PHYS,212,University Physics: Elec &amp; Mag,"Coulomb's Law, electric fields, Gauss' Law, electric potential, capacitance, circuits, magnetic forces and fields, Ampere's law, induction, electromagnetic waves, polarization, and geometrical optics. A calculus-based approach for majors in engineering, mathematics, physics, and chemistry. Credit is not given for both PHYS 212 and PHYS 102. Prerequisite: PHYS 211; credit or concurrent registration in MATH 241.",4 hours.,"Nat Sci & Tech - Phys Sciences, and Quantitative Reasoning II course.",Lecture,02:00 PM,02:50 PM,TR,"Kwiat, P",PHYS 212,4.4,2.896608333333333,https://www.reddit.com/r/UIUC/search/?q=PHYS212&type=link&cId=b32ceb77-1b8c-40e5-8b34-d2b4fec8c4b6&iId=bfd40497-f1e5-4941-9509-aa6fccd80b9e
