,Year,Term,Subject,Number,Name,Description,Credit Hours,Degree Attributes,Type,Start Time,End Time,Days of Week,Instructors,Class,ProfRating,GPA,Reddit_Links
0,2024,Spring,AAS,100,Intro Asian American Studies,"Interdisciplinary introduction to the basic concepts and approaches in Asian American Studies. Surveys the various dimensions of Asian American experiences including history, social organization, literature, arts, and politics.",3 hours.,"Social & Beh Sci - Soc Sci, and Cultural Studies - US Minority course.",Lecture,10:00 AM,10:50 AM,MW,"Guruparan, A",AAS 100,1.0,3.6760784313725487,https://www.reddit.com/r/UIUC/search/?q=AAS100&type=link&cId=b32ceb77-1b8c-40e5-8b34-d2b4fec8c4b6&iId=bfd40497-f1e5-4941-9509-aa6fccd80b9e
1,2024,Spring,AAS,200,U.S. Race and Empire,"Invites students to examine histories and narratives of U.S. race and empire, drawing upon multiple theoretical and methodological works in Asian American studies and related fields. Same as LLS 200.",3 hours.,"Humanities - Hist & Phil, and Cultural Studies - US Minority course.",Lecture-Discussion,02:30 PM,03:50 PM,TR,"Sawada, E",AAS 200,-1.0,3.453432835820895,https://www.reddit.com/r/UIUC/search/?q=AAS200&type=link&cId=b32ceb77-1b8c-40e5-8b34-d2b4fec8c4b6&iId=bfd40497-f1e5-4941-9509-aa6fccd80b9e
2,2024,Spring,AAS,300,"Theories of Race, Gender, and Sexuality","Explores theories for performing interdisciplinary, intersectional and comparative studies within the field of Asian American studies. Follows multiple genealogies of critical work in ethnic and American studies. Same as GWS 305 and LLS 305.",3 hours.,Advanced Composition course.,Lecture-Discussion,01:00 PM,02:20 PM,TR,"Bui, K",AAS 300,-1.0,,https://www.reddit.com/r/UIUC/search/?q=AAS300&type=link&cId=b32ceb77-1b8c-40e5-8b34-d2b4fec8c4b6&iId=bfd40497-f1e5-4941-9509-aa6fccd80b9e
3,2024,Spring,ABE,152,Water in the Global Environment,"This course develops a comprehensive understanding and appreciation of water and its impact in a global context. The course emphasizes cultural practices associated with water and its use, especially for regions in non-western cultures. Students will develop critical knowledge of: 1) water availability, water quality, and global challenges; 2) historical perspectives of water use; 3) past, present, and future environmental sustainability in relation to water, food, and energy; and 4) conduct analysis of cultural practices and their sustainability based on water in a global context. Students attend 3-4 field trips related to the course.",3 hours.,"Cultural Studies - Non-West, and Nat Sci & Tech - Phys Sciences course.",Online,01:00 PM,02:50 PM,MW,"Bhattarai, R;Davidson, P;Kalita, P",ABE 152,-1.0,3.7794270833333337,https://www.reddit.com/r/UIUC/search/?q=ABE152&type=link&cId=b32ceb77-1b8c-40e5-8b34-d2b4fec8c4b6&iId=bfd40497-f1e5-4941-9509-aa6fccd80b9e
4,2024,Spring,ABE,232,Context in International Interventions,"This multi-disciplinary course will examine a new approach to infrastructure engineering for alternately developed societies that seeks to counteract the disconnects and differing objectives among project stakeholders that result in lack of infrastructure sustainability and resiliency. Using a case study from Western Africa, the course will consider the impact of globalization, the attitudes of industrialized societies, and the role of place-based knowledge in designing and implementing infrastructure interventions for rural societies. Same as AFST 233.",3 hours.,"Cultural Studies - Non-West, and Social & Beh Sci - Soc Sci course.",Online Lecture,01:00 PM,02:50 PM,MWF,"Witmer, A",ABE 232,0.0,3.588235294117647,https://www.reddit.com/r/UIUC/search/?q=ABE232&type=link&cId=b32ceb77-1b8c-40e5-8b34-d2b4fec8c4b6&iId=bfd40497-f1e5-4941-9509-aa6fccd80b9e
5,2024,Spring,ABE,469,Capstone Design Experience,"Design projects which utilize principles of design, engineering analysis and functional operation of engineering systems. Projects originate from industry, nonprofit entities and federal agencies. Design teams develop concepts, evaluate alternatives, model and analyze solutions, and build and test a final product. Emphases on communication skills, technical writing, and interaction with industry representatives. 4 undergraduate hours. No graduate credit. Prerequisite: Current senior standing in an engineering major. Restricted to undergraduate students.",4 hours.,Advanced Composition course.,Lecture-Discussion,12:30 PM,01:50 PM,TR,"Nunez, J;Witmer, A",ABE 469,-1.0,,https://www.reddit.com/r/UIUC/search/?q=ABE469&type=link&cId=b32ceb77-1b8c-40e5-8b34-d2b4fec8c4b6&iId=bfd40497-f1e5-4941-9509-aa6fccd80b9e
6,2024,Spring,ACE,100,Introduction to Applied Microeconomics,"Provides students an introduction to microeconomics by examining such topics as: individual and household decision-making regarding how to spend income and how many hours to work; decision-making by firms about production quantities, how many workers to hire, and what price to charge to maximize profits; the well-being of consumers in competitive markets compared to oligopolies and monopolies; and the role of government when markets fail (e.g., environmental, anti-trust, labor market issues, etc.). Credit is not given toward graduation for ACE 100 if credit for ECON 102 has been earned.",4 hours.,Social & Beh Sci - Soc Sci course.,Lecture,09:00 AM,10:20 AM,TR,"Gundersen, L",ACE 100,-1.0,3.160432692307692,https://www.reddit.com/r/UIUC/search/?q=ACE100&type=link&cId=b32ceb77-1b8c-40e5-8b34-d2b4fec8c4b6&iId=bfd40497-f1e5-4941-9509-aa6fccd80b9e
7,2024,Spring,ACE,210,Environmental Economics,"Applies economic tools to analyze environmental problems and public policy formation. We will study human behavior to understand why environmental problems occur and our choice of policy tools to address problems. We will explore and critique current environmental policies in the U.S. and globally in a rigorous and constructive manner and the role of private-sector agents in solving environmental problems. Through this course, you will build your capacity for critical thinking and problem-solving. Same as ECON 210, ENVS 210, NRES 210, and UP 210.",3 hours.,Social & Beh Sci - Soc Sci course.,Lecture,03:00 PM,03:50 PM,MW,"Damon, L",ACE 210,-1.0,3.1430288461538467,https://www.reddit.com/r/UIUC/search/?q=ACE210&type=link&cId=b32ceb77-1b8c-40e5-8b34-d2b4fec8c4b6&iId=bfd40497-f1e5-4941-9509-aa6fccd80b9e
8,2024,Spring,ACE,251,The World Food Economy,"Examination of global food production, consumption, and trade; problems of hunger and population; the role of agricultural development, trade, and aid in relieving hunger. Prerequisite: ACE 100 or ECON 102 or consent of instructor.",3 hours.,"Grand Challenge-Sustainability, Cultural Studies - Non-West, and Social & Beh Sci - Soc Sci course.",Online Lecture,ARRANGED,,,"Michelson, H",ACE 251,-1.0,3.5571284634760705,https://www.reddit.com/r/UIUC/search/?q=ACE251&type=link&cId=b32ceb77-1b8c-40e5-8b34-d2b4fec8c4b6&iId=bfd40497-f1e5-4941-9509-aa6fccd80b9e
9,2024,Spring,ACE,254,Economic Systems in Africa,"Examines systems of production and exchange in Africa. Through lectures, discussions, readings and films participants will study the ways African people interact in local markets and the impact of national and international markets on their welfare. Same as AFST 254.",3 hours.,"Cultural Studies - Non-West, and Social & Beh Sci - Soc Sci course.",Lecture-Discussion,02:00 PM,03:20 PM,TR,"Herrera Almanza, C",ACE 254,-1.0,,https://www.reddit.com/r/UIUC/search/?q=ACE254&type=link&cId=b32ceb77-1b8c-40e5-8b34-d2b4fec8c4b6&iId=bfd40497-f1e5-4941-9509-aa6fccd80b9e
10,2024,Spring,ACE,262,Applied Statistical Methods and Data Analytics I,"Statistics is a key tool in the data analysis process, which involves data collection, data description, data analysis, and results interpretation. ACE 262 discusses how to collect data and how to analyze these data using descriptive statistics. Descriptive statistics help summarize the data in a meaningful way and identify possible patterns. The course also introduces random variables, probability distributions, hypothesis testing, simple linear regression, and the theoretical underpinnings of these concepts. An emphasis is placed on examples from the field of economics, but other areas are represented as well. Course content enhances students’ critical thinking skills and their ability to apply appropriate models to professional and everyday problems. Credit is not given toward graduation for ACE 262 if credit for any of ECON 202, CPSC 241, STAT 100, or equivalent has been earned.",3 hours.,Quantitative Reasoning I course.,Lecture,11:00 AM,12:20 PM,TR,"Gundersen, L",ACE 262,-1.0,3.08035,https://www.reddit.com/r/UIUC/search/?q=ACE262&type=link&cId=b32ceb77-1b8c-40e5-8b34-d2b4fec8c4b6&iId=bfd40497-f1e5-4941-9509-aa6fccd80b9e
11,2024,Spring,ACES,102,Intro Sustainable Food Systems,"An objective approach towards critical systems thinking and towards collaborative analysis across multiple disciplines for the development, production, preparation, consumption, and utilization of food, feed, fiber and energy, while managing the disposal and reuse of byproducts, within complex socioeconomic, ecological and environmental systems. Students will be introduced to the fundamentals of modern crop, livestock, and other agricultural production systems, and consider the future challenges and opportunities in producing enough for a growing world population.",3 hours.,Nat Sci & Tech - Life Sciences course.,Lecture-Discussion,02:00 PM,03:20 PM,TR,"Ball, A;Duitsman, K",ACES 102,-1.0,3.9204,https://www.reddit.com/r/UIUC/search/?q=ACES102&type=link&cId=b32ceb77-1b8c-40e5-8b34-d2b4fec8c4b6&iId=bfd40497-f1e5-4941-9509-aa6fccd80b9e
12,2024,Spring,ADV,150,Introduction to Advertising,"Introduction to the practice and profession of advertising. Course material covers various functional areas of advertising and integrated brand promotion, including account planning, creative, media, research, consumer behavior, sales promotion and interactive advertising. Topics also include how advertising relates to society in cultural, social, ethical and regulatory contexts. Open to all undergraduate majors.",3 hours.,Social & Beh Sci - Soc Sci course.,Lecture-Discussion,02:00 PM,02:50 PM,TR,"Hall, S",ADV 150,4.1,3.741989881956155,https://www.reddit.com/r/UIUC/search/?q=ADV150&type=link&cId=b32ceb77-1b8c-40e5-8b34-d2b4fec8c4b6&iId=bfd40497-f1e5-4941-9509-aa6fccd80b9e
13,2024,Spring,ADV,175,Diversity in Advertising,"Examines the multifaceted role diversity (including racial, gender, orientation, ability status) plays in the delivery and reception of advertising. Additionally, it examines the development of diversity as a marketplace practice and on the development of the advertising industry. We'll analyze advertising using a historical, cultural, and social perspective and address issues of diversity in the industry. We will also critically review current issues of multicultural, transcultural and multidimensional advertising and marketing. In the process we’ll grapple with current theories on race and implicit /explicit bias and prejudice and their impact upon the production of advertising and consumer communications.",3 hours.,Cultural Studies - US Minority course.,Lecture,12:30 PM,01:50 PM,MW,"Chambers, J",ADV 175,3.3,3.3225945945945945,https://www.reddit.com/r/UIUC/search/?q=ADV175&type=link&cId=b32ceb77-1b8c-40e5-8b34-d2b4fec8c4b6&iId=bfd40497-f1e5-4941-9509-aa6fccd80b9e
14,2024,Spring,ADV,200,Data Literacy,"No matter what your major, or the job you plan to get, becoming fluent at working with data is a sought-after skill. Through lectures and guided workshops, this course provides hands-on- training on fundamentals of data exploration (asking the right questions), data gathering and data analysis (understanding and describing the situation) as well as communicating with data (telling a compelling story through data visualizations). Students learn how to find datasets in online archives and repositories, and are introduced to the commonly used software packages and techniques (spreadsheets, text analytics, social computing). We also focus on critical issues such as data ethics and privacy. We also learn basic computer programming aimed at data analysis. No prior knowledge of research methods, statistics or programming is required.",3 hours.,Quantitative Reasoning I course.,Lecture,12:30 PM,01:50 PM,T,"Taneja, H",ADV 200,2.5,3.3658823529411763,https://www.reddit.com/r/UIUC/search/?q=ADV200&type=link&cId=b32ceb77-1b8c-40e5-8b34-d2b4fec8c4b6&iId=bfd40497-f1e5-4941-9509-aa6fccd80b9e
15,2024,Spring,ADV,393,Advertising and Society,"Provides a critical understanding of advertising's role in modern society. Advertising will be studied as a cultural force and social institution. Its role will be examined in relation to communications, economics, and political and legal systems. Credit is not given for ADV 393 if credit for ADV 493 has been earned. Prerequisite: Restricted to students with Sophomore, Junior, or Senior class standing.",3 hours.,Social & Beh Sci - Soc Sci course.,Lecture-Discussion,12:00 PM,01:20 PM,MW,"Wilson, C",ADV 393,5.0,3.735470085470085,https://www.reddit.com/r/UIUC/search/?q=ADV393&type=link&cId=b32ceb77-1b8c-40e5-8b34-d2b4fec8c4b6&iId=bfd40497-f1e5-4941-9509-aa6fccd80b9e
16,2024,Spring,AE,443,Aerospace Systems Design II,"Continuation of AE 442. Conceptual design project of either an aircraft or spacecraft flight system to satisfy a given set of requirements. Project team organization. Emphasis on sizing, trade studies and design optimization, subsystem integration, and technical communication skills. 3 undergraduate hours. No graduate credit. To fulfill the Advanced Composition Requirement, credit must be earned for both AE 442 and AE 443. Prerequisite: AE 442.",3 hours.,Advanced Composition course.,Lecture-Discussion,02:00 PM,03:20 PM,TR,"Merret, J",AE 443,-1.0,3.536384615384616,https://www.reddit.com/r/UIUC/search/?q=AE443&type=link&cId=b32ceb77-1b8c-40e5-8b34-d2b4fec8c4b6&iId=bfd40497-f1e5-4941-9509-aa6fccd80b9e
17,2024,Spring,AFRO,100,Intro to African American St,"Interdisciplinary introduction to the basic concepts and literature in the disciplines covered by African American studies; surveys the major approaches to the study of African Americans across several academic disciplines including economics, education, psychology, literature, political science, sociology and others.",3 hours.,"Social & Beh Sci - Soc Sci, and Cultural Studies - US Minority course.",Lecture-Discussion,11:00 AM,12:20 PM,TR,"McMillion, D",AFRO 100,-1.0,3.1419200000000003,https://www.reddit.com/r/UIUC/search/?q=AFRO100&type=link&cId=b32ceb77-1b8c-40e5-8b34-d2b4fec8c4b6&iId=bfd40497-f1e5-4941-9509-aa6fccd80b9e
18,2024,Spring,AFRO,132,African American Music,"Survey of African American music, from its origins to the present with a focus on understanding details of musical performance and the ways in which music interacts with its social and political context. Examines genres such as spirituals, the blues, jazz, R&B, soul, and hip-hop. No previous musical background is necessary.",3 hours.,"Humanities - Lit & Arts, and Cultural Studies - US Minority course.",Lecture,02:00 PM,02:50 PM,MW,,AFRO 132,,3.3063636363636366,https://www.reddit.com/r/UIUC/search/?q=AFRO132&type=link&cId=b32ceb77-1b8c-40e5-8b34-d2b4fec8c4b6&iId=bfd40497-f1e5-4941-9509-aa6fccd80b9e
19,2024,Spring,AFRO,228,Hip Hop Music: History and Culture,"A study of hip-hop from its beginnings in the post-industrial South Bronx of the 1970s to the global present. By focusing on the work of specific artists and movements, we will compare and contrast the production and consumption of hip-hop with other forms of popular music (including jazz, rock, disco, and pop). This course shows how musicians and listeners use hip-hop to express ideas about topics such as economics, nationalism, black power, feminism, and violence.",3 hours.,"Humanities - Lit & Arts, and Cultural Studies - US Minority course.",Lecture-Discussion,03:30 PM,04:50 PM,MW,"Meyers, J",AFRO 228,5.0,3.7903703703703706,https://www.reddit.com/r/UIUC/search/?q=AFRO228&type=link&cId=b32ceb77-1b8c-40e5-8b34-d2b4fec8c4b6&iId=bfd40497-f1e5-4941-9509-aa6fccd80b9e
20,2024,Spring,AFST,210,Introduction to Modern African Literature,Significant contemporary African writings depicting the history and cultural traditions of African peoples. Same as CWL 210 and ENGL 211.,3 hours.,"Humanities - Lit & Arts, and Cultural Studies - Non-West course.",Lecture-Discussion,11:00 AM,11:50 AM,MWF,"Toure, V",AFST 210,-1.0,,https://www.reddit.com/r/UIUC/search/?q=AFST210&type=link&cId=b32ceb77-1b8c-40e5-8b34-d2b4fec8c4b6&iId=bfd40497-f1e5-4941-9509-aa6fccd80b9e
21,2024,Spring,AHS,125,Freshmen Scholars Seminar,Designed for James Scholars for Applied Health Sciences who are in their first year of college to introduce them to research. Students will learn strategies to apply classroom material to community and society. Includes visits from faculty and staff from across campus and within the College who will expose students to an array of contexts and approaches for research. This course is a James Scholar course for freshmen only.,1 hours.,James Scholars course.,Lecture,11:00 AM,11:50 AM,F,"Pulley, T",AHS 125,0.0,3.8333333333333335,https://www.reddit.com/r/UIUC/search/?q=AHS125&type=link&cId=b32ceb77-1b8c-40e5-8b34-d2b4fec8c4b6&iId=bfd40497-f1e5-4941-9509-aa6fccd80b9e
22,2024,Spring,AIS,101,Intro to Amer Indian Studies,"Interdisciplinary introduction surveys the stories, histories, and lands of tribal peoples who became known as ""American Indians"".",3 hours.,"Humanities - Hist & Phil, and Cultural Studies - US Minority course.",Lecture-Discussion,01:00 PM,02:15 PM,MW,"Ryan Burchfield, R",AIS 101,-1.0,3.6525,https://www.reddit.com/r/UIUC/search/?q=AIS101&type=link&cId=b32ceb77-1b8c-40e5-8b34-d2b4fec8c4b6&iId=bfd40497-f1e5-4941-9509-aa6fccd80b9e
23,2024,Spring,AIS,265,Intro to American Indian Lit,"Introduces students to the study of American Indian literature by focusing on texts by contemporary American Indian novelists, poets, and playwrights. Over the course of the semester, students will consider how indigenous aesthetics shape narrative in addition to examining how American Indian authors engage the legacies of colonization and the histories of their tribal communities through their stories. Same as ENGL 265.",3 hours.,"Humanities - Lit & Arts, and Cultural Studies - US Minority course.",Lecture-Discussion,11:00 AM,12:15 PM,TR,"Rymhs, D",AIS 265,-1.0,3.1254166666666667,https://www.reddit.com/r/UIUC/search/?q=AIS265&type=link&cId=b32ceb77-1b8c-40e5-8b34-d2b4fec8c4b6&iId=bfd40497-f1e5-4941-9509-aa6fccd80b9e
24,2024,Spring,AIS,285,Indigenous Thinkers,An introduction to the English-language traditions of indigenous intellectuals. Specific topics vary. May be repeated in the same term to a maximum of 6 hours. May be repeated in subsequent terms to a maximum of 9 hours.,3 hours.,"Humanities - Hist & Phil, and Cultural Studies - Non-West course.",Lecture-Discussion,02:00 PM,03:15 PM,MW,"Maldonado, K",AIS 285,2.4,3.610693069306931,https://www.reddit.com/r/UIUC/search/?q=AIS285&type=link&cId=b32ceb77-1b8c-40e5-8b34-d2b4fec8c4b6&iId=bfd40497-f1e5-4941-9509-aa6fccd80b9e
25,2024,Spring,ANSC,110,Life With Animals and Biotech,"Lecture/discussion course that will provide students an overview of biotechnology and animals. Focuses on biotechnological achievements involving animals and how they influence the global development of agriculture, medicine, and industry. Topics will be covered from scientific, discovery, historical, social, and political perspectives. Credit is not given to Animal Science majors.",3 hours.,Nat Sci & Tech - Life Sciences course.,Lecture-Discussion,03:00 PM,04:50 PM,TR,"Allen, C",ANSC 110,0.0,3.507391304347826,https://www.reddit.com/r/UIUC/search/?q=ANSC110&type=link&cId=b32ceb77-1b8c-40e5-8b34-d2b4fec8c4b6&iId=bfd40497-f1e5-4941-9509-aa6fccd80b9e
26,2024,Spring,ANSC,205,World Animal Resources,"Examination of the world's animals, domesticated and wild, and their uses in various climatic, economic and cultural contexts. Exploration of their contemporary management and their future prospects. Provides background for international experiences, such as ACES 298 and ACES 299. Prerequisite: Completion of the campus Composition I general education requirement.",3 hours.,Advanced Composition course.,Lecture-Discussion,03:30 PM,04:50 PM,TR,"Emmert, J;Parsons, C",ANSC 205,5.0,3.541700879765396,https://www.reddit.com/r/UIUC/search/?q=ANSC205&type=link&cId=b32ceb77-1b8c-40e5-8b34-d2b4fec8c4b6&iId=bfd40497-f1e5-4941-9509-aa6fccd80b9e
27,2024,Spring,ANSC,207,The Science of Pets and How to Care for Them,"Provides students with the knowledge and skills necessary to care for animal species commonly kept as pets. Biological concepts of anatomy, genetics, evolution, nutrition, reproduction, and behavior will provide valuable insight into companion animal husbandry practices for dogs, cats, small mammals, birds, fish, reptiles, and amphibians. Credit is not given for both ANSC 207 and ANSC 307.",3 hours.,Nat Sci & Tech - Life Sciences course.,Online,ARRANGED,,,"Schneider, A",ANSC 207,5.0,3.1584843492586483,https://www.reddit.com/r/UIUC/search/?q=ANSC207&type=link&cId=b32ceb77-1b8c-40e5-8b34-d2b4fec8c4b6&iId=bfd40497-f1e5-4941-9509-aa6fccd80b9e
28,2024,Spring,ANSC,250,Companion Animals in Society,"Explores the current and historical functions and influences of companion animals in American society. Topics include the evolution of animal protection, the use of assistance and service animals, and the growth of the pet supply industry. Controversial issues which are of current concern to society will also be examined.",3 hours.,Cultural Studies - Western course.,Online,ARRANGED,,,"Richardson, S",ANSC 250,3.9,3.7264122137404585,https://www.reddit.com/r/UIUC/search/?q=ANSC250&type=link&cId=b32ceb77-1b8c-40e5-8b34-d2b4fec8c4b6&iId=bfd40497-f1e5-4941-9509-aa6fccd80b9e
29,2024,Spring,ANSC,255,Animal Ethics,"Explores ethical issues raised by human use of animals. Students will be asked to apply philosophical perspectives to historical and current animal issues such as raising animals for food production, the keeping of pets, management and use of wild animals, use of animals in research, animal breeding and biotechnology, and animal control.",3 hours.,Humanities - Hist & Phil course.,Online Lecture,ARRANGED,,,"Shike, D",ANSC 255,-1.0,3.755670103092784,https://www.reddit.com/r/UIUC/search/?q=ANSC255&type=link&cId=b32ceb77-1b8c-40e5-8b34-d2b4fec8c4b6&iId=bfd40497-f1e5-4941-9509-aa6fccd80b9e
30,2024,Spring,ANTH,101,Introduction to Anthropology,"Anthropology was first envisioned as a holistic discipline, combining insights from the study of human anatomy and evolution, research on material remains of human settlements, and the analysis of social interaction in language and other cultural practices. Following this tradition, this course explores the questions about where humans came from, how societies live and communicate, and why human cultural groups vary.",3 hours.,"Social & Beh Sci - Soc Sci, and Cultural Studies - Western course.",Online Lecture,ARRANGED,,,"Ritchison, B",ANTH 101,3.9,3.609809941520467,https://www.reddit.com/r/UIUC/search/?q=ANTH101&type=link&cId=b32ceb77-1b8c-40e5-8b34-d2b4fec8c4b6&iId=bfd40497-f1e5-4941-9509-aa6fccd80b9e
31,2024,Spring,ANTH,103,Anthro in a Changing World,"Presents the fundamental areas of anthropological analysis through a series of comparative cases that emphasize social and cultural relations in global contexts. Directs attention to the anthropological history of global empires and colonial states, their cultural exchanges, and contemporary studies of culture, society, and globalization.",3 hours.,"Cultural Studies - Non-West, and Social & Beh Sci - Soc Sci course.",Lecture,10:00 AM,10:50 AM,MW,"Martin, J",ANTH 103,3.5,3.673607176581681,https://www.reddit.com/r/UIUC/search/?q=ANTH103&type=link&cId=b32ceb77-1b8c-40e5-8b34-d2b4fec8c4b6&iId=bfd40497-f1e5-4941-9509-aa6fccd80b9e
32,2024,Spring,ANTH,110,Humanizing Science,"Scientists are often taught that the skills they need are confined to conducting research in the lab, the field, or the observatory. Yet science is also a human endeavor. If scientists are not taught this lesson, mistakes can be made that have real implications for people's lives, for scientific progress, and for who gets to be a scientist. Therefore this course will introduce 1) a brief history of Western and non-Western science, 2) the influences of social categories and oppressions on scientific advancement, 3) the incentive and reward structure of science, and 4) stories of scientists who have chosen to walk a brave path in the way they conduct and disseminate their research. We will engage in a mix of ethnographic and case study work and bring interpretive and systematic analysis to bear on what it means to be a scientist. The ultimate goal of the course is to provide a substantive, rigorous, and broad introduction to the culture of science, and how that culture affects the people of science, its practice, and its process.",3 hours.,Social & Beh Sci - Soc Sci course.,Lecture-Discussion,09:30 AM,10:50 AM,TR,"Saboowala, S",ANTH 110,0.0,,https://www.reddit.com/r/UIUC/search/?q=ANTH110&type=link&cId=b32ceb77-1b8c-40e5-8b34-d2b4fec8c4b6&iId=bfd40497-f1e5-4941-9509-aa6fccd80b9e
